"DESCRIPTION","DURATION IN MS","NAME","PARENT SUITE","START TIME","STATUS","STOP TIME","SUB SUITE","SUITE","TEST CLASS","TEST METHOD"
"","28913","Un utilisateur peut ajouter un portefeuille non hébergé avec succès","local_desktop_nonReg","2026-03-05","passed","2026-03-05","","wallet/unhosted-wallets.spec.ts","",""
"","23640","Le formulaire de création de token API affiche les messages d'erreur appropriés en cas de données invalides","local_desktop_nonReg","2026-03-05","passed","2026-03-05","","connections/api-tokens/create-form-validations.spec.ts","",""
"","93855","Un utilisateur peut déposer des euros sur son compte via Open Banking avec succès","local_desktop_nonReg","2026-03-05","passed","2026-03-05","","transfers/deposit.spec.ts","",""
"","66639","Un utilisateur peut vendre du BTC au marché avec succès","local_desktop_nonReg","2026-03-05","failed","2026-03-05","","trading/expert-mode.spec.ts","",""
"","31554","Un utilisateur peut naviguer du dashboard vers l'achat de BTC via la fiche crypto","local_desktop_nonReg","2026-03-05","failed","2026-03-05","","navigation/to-buy/dashboard-to-btc-buy.spec.ts","",""
"","474555","Un Utilisateur B2B peut compléter le flow d'onboarding avec succès","local_desktop_nonReg","2026-03-05","passed","2026-03-05","","onboarding/complete-flows.spec.ts","",""
"","30486","Un utilisateur peut naviguer et soumettre le formulaire de connexion au clavier","local_desktop_nonReg","2026-03-05","passed","2026-03-05","","authentication/sign-in/keyboard-navigation.spec.ts","",""
"","27994","Un utilisateur peut vendre de l'ETH avec succès","local_desktop_nonReg","2026-03-05","failed","2026-03-05","","trading/sell-cryptos.spec.ts","",""
"","74231","Un utilisateur peut acheter du BTC en ordre limite avec succès","local_desktop_nonReg","2026-03-05","failed","2026-03-05","","trading/expert-mode.spec.ts","",""
"","38542","Un utilisateur peut envoyer des cryptomonnaies à un destinataire via son adresse email avec succès","local_desktop_nonReg","2026-03-05","passed","2026-03-05","","transfers/send-by-email.spec.ts","",""
"","38180","Un utilisateur peut échanger de l'ETH contre de l'USDC avec succès","local_desktop_nonReg","2026-03-05","failed","2026-03-05","","trading/swap-cryptos.spec.ts","",""
"","31668","Un utilisateur peut naviguer du dashboard vers l'achat d'ETH via la fiche crypto","local_desktop_nonReg","2026-03-05","failed","2026-03-05","","navigation/to-buy/dashboard-to-eth-buy.spec.ts","",""
"","43806","Un utilisateur peut effectuer un transfert interne entre ses comptes trading->deposit avec succès","local_desktop_nonReg","2026-03-05","failed","2026-03-05","","transfers/internal-transfer.spec.ts","",""
"","26141","Un utilisateur peut naviguer du dashboard vers l'achat d'USDC via la fiche crypto","local_desktop_nonReg","2026-03-05","failed","2026-03-05","","navigation/to-buy/dashboard-to-usdc-buy.spec.ts","",""
"","20753","Le formulaire de connexion affiche les messages d'erreur appropriés en cas de données invalides","local_desktop_nonReg","2026-03-05","passed","2026-03-05","","authentication/sign-in/form-validations.spec.ts","",""
"","32796","Un utilisateur peut retirer des euros de son compte avec succès","local_desktop_nonReg","2026-03-05","failed","2026-03-05","","transfers/withdraw.spec.ts","",""
"","35585","La page d'achat/vente respecte les règles d'accessibilité (axe-core)","local_desktop_nonReg","2026-03-05","passed","2026-03-05","","trading/accessibility.spec.ts","",""
"","38359","Un utilisateur peut supprimer un token API avec succès","local_desktop_nonReg","2026-03-05","failed","2026-03-05","","connections/api-tokens/delete-nominal.spec.ts","",""
"","57858","Un utilisateur peut ajouter une adresse de retrait BTC avec succès","local_desktop_nonReg","2026-03-05","failed","2026-03-05","","wallet/crypto-address.spec.ts","",""
"","32556","Un utilisateur peut créer, éditer, mettre en pause, reprendre et stopper un DCA","local_desktop_nonReg","2026-03-05","failed","2026-03-05","","investment/dca.spec.ts","",""
"","353350","Un utilisateur peut changer son mot de passe avec succès","local_desktop_nonReg","2026-03-05","passed","2026-03-05","","account/change-password/nominal.spec.ts","",""
"","25743","La page d'inscription B2C (email) respecte les règles d'accessibilité (axe-core)","local_desktop_nonReg","2026-03-05","passed","2026-03-05","","onboarding/accessibility.spec.ts","",""
"","52176","Un utilisateur peut effectuer un transfert interne entre ses comptes deposit->trading avec succès","local_desktop_nonReg","2026-03-05","failed","2026-03-05","","transfers/internal-transfer.spec.ts","",""
"","28793","Un utilisateur sans paramètre redirect est redirigé vers le dashboard par défaut après connexion","local_desktop_nonReg","2026-03-05","passed","2026-03-05","","authentication/sign-in/redirections.spec.ts","",""
"","85212","Un utilisateur ne peut pas changer son mot de passe avec un mot de passe actuel incorrect","local_desktop_nonReg","2026-03-05","passed","2026-03-05","","account/change-password/bad-current-password.spec.ts","",""
"","418652","Un utilisateur non approuvé ne peut pas initier un retrait et voit un message d'erreur approprié","local_desktop_nonReg","2026-03-05","passed","2026-03-05","","transfers/withdraw.notApproved.spec.ts","",""
"","270453","Un utilisateur peut créer un ticket de support, ajouter un commentaire, puis fermer le ticket","local_desktop_nonReg","2026-03-05","passed","2026-03-05","","support/support-tickets.spec.ts","",""
"","41196","Un utilisateur peut naviguer vers les principales sections du site via le menu utilisateur","local_desktop_nonReg","2026-03-05","passed","2026-03-05","","navigation/in-app/user-menu.spec.ts","",""
"","1940","Un utilisateur peut naviguer vers les principales sections du site via le menu responsive","local_desktop_nonReg","2026-03-05","skipped","2026-03-05","","navigation/in-app/responsive-menu.spec.ts","",""
"","108478","Un utilisateur peut réinitialiser son mot de passe avec succès via le lien envoyé par email","local_desktop_nonReg","2026-03-05","passed","2026-03-05","","authentication/reset-password/nominal.spec.ts","",""
"","46427","Le formulaire d'achat de cryptomonnaies affiche les messages d'erreur appropriés en cas de données invalides","local_desktop_nonReg","2026-03-05","passed","2026-03-05","","trading/buy-cryptos.spec.ts","",""
"","375370","Un utilisateur avec l'authentification à deux facteurs activée ne peut pas se connecter avec un code 2FA incorrect","local_desktop_nonReg","2026-03-05","passed","2026-03-05","","authentication/two-factor/bad-code-login.spec.ts","",""
"","41804","Un utilisateur peut échanger de l'ETH contre du BTC avec succès","local_desktop_nonReg","2026-03-05","failed","2026-03-05","","trading/swap-cryptos.spec.ts","",""
"","27369","Un utilisateur non approuvé est redirigé vers la page d'onboarding incomplète après connexion","local_desktop_nonReg","2026-03-05","passed","2026-03-05","","authentication/sign-in/resume-onboarding.spec.ts","",""
"","46791","La page de présentation du Plan Bitcoin Famille est accessible et affiche les informations clés","local_desktop_nonReg","2026-03-05","passed","2026-03-05","","investment/family-plan.spec.ts","",""
"","38722","Un utilisateur peut envoyer des euros à un destinataire via son adresse email avec succès","local_desktop_nonReg","2026-03-05","passed","2026-03-05","","transfers/send-by-email.spec.ts","",""
"","29138","Un utilisateur ne peut pas créer un token API avec un mot de passe incorrect","local_desktop_nonReg","2026-03-05","passed","2026-03-05","","connections/api-tokens/create-bad-password.spec.ts","",""
"","25360","Le formulaire de création de bouton marchand affiche les messages d'erreur appropriés en cas de données invalides","local_desktop_nonReg","2026-03-05","passed","2026-03-05","","connections/merchant-buttons/create-form-validations.spec.ts","",""
"","41606","Un utilisateur peut naviguer entre les onglets de l'historique","local_desktop_nonReg","2026-03-05","failed","2026-03-05","","history/transactions-history/transaction-history.spec.ts","",""
"","20155","Un utilisateur peut acheter de l'USDC via le compte de trading avec succès","local_desktop_nonReg","2026-03-05","failed","2026-03-05","","trading/buy-cryptos.spec.ts","",""
"","33999","Un utilisateur peut se déconnecter avec succès","local_desktop_nonReg","2026-03-05","passed","2026-03-05","","authentication/sign-out/nominal.spec.ts","",""
"","30586","Un utilisateur peut vendre de l'USDC avec succès","local_desktop_nonReg","2026-03-05","failed","2026-03-05","","trading/sell-cryptos.spec.ts","",""
"","34465","L'onglet Ordres affiche les ordres avec les informations attendues","local_desktop_nonReg","2026-03-05","failed","2026-03-05","","history/transactions-history/transaction-history.spec.ts","",""
"","27153","Un utilisateur non authentifié peut accéder aux routes publiques sans être redirigé vers la page de connexion","local_desktop_nonReg","2026-03-05","passed","2026-03-05","","authentication/public-routes/unauthenticated-access.spec.ts","",""
"","37821","Un utilisateur peut supprimer un bouton marchand avec succès","local_desktop_nonReg","2026-03-05","passed","2026-03-05","","connections/merchant-buttons/delete.spec.ts","",""
"","72182","Un utilisateur peut naviguer vers les principales sections du site via la barre de navigation","local_desktop_nonReg","2026-03-05","failed","2026-03-05","","navigation/in-app/web-navbar.spec.ts","",""
"","64532","Un utilisateur peut annuler un ordre actif BTC avec succès","local_desktop_nonReg","2026-03-05","failed","2026-03-05","","trading/expert-mode.spec.ts","",""
"","122793","Un utilisateur non authentifié est redirigé vers la page de connexion lorsqu'il tente d'accéder aux routes protégées","local_desktop_nonReg","2026-03-05","passed","2026-03-05","","authentication/protected-routes/unauthenticated-access.spec.ts","",""
"","38920","La déconnexion dans un onglet invalide la session dans un autre onglet","local_desktop_nonReg","2026-03-05","passed","2026-03-05","","authentication/session/multi-sessions-invalidate.spec.ts","",""
"","69586","Le mode expert respecte les règles d'accessibilité (axe-core)","local_desktop_nonReg","2026-03-05","passed","2026-03-05","","trading/accessibility.spec.ts","",""
"","177355","Un utilisateur peut acheter du BTC via une nouvelle carte de paiement avec succès","local_desktop_nonReg","2026-03-05","failed","2026-03-05","","trading/buy-cryptos.spec.ts","",""
"","40335","Le formulaire de création de bouton marchand affiche les messages d'erreur appropriés en cas de données invalides","local_desktop_nonReg","2026-03-05","passed","2026-03-05","","connections/merchant-buttons/create-nominal.spec.ts","",""
"","26055","Un utilisateur peut se connecter avec des identifiants valides et sans 2FA","local_desktop_nonReg","2026-03-05","passed","2026-03-05","","authentication/sign-in/nominal.spec.ts","",""
"","26602","Un utilisateur peut déposer des cryptomonnaies sur son compte avec succès","local_desktop_nonReg","2026-03-05","passed","2026-03-05","","transfers/deposit.spec.ts","",""
"","47368","Un utilisateur peut vendre du BTC en ordre limite avec succès","local_desktop_nonReg","2026-03-05","failed","2026-03-05","","trading/expert-mode.spec.ts","",""
"","11806","Un utilisateur peut accepter tous les cookies et la modale se ferme","local_desktop_nonReg","2026-03-05","passed","2026-03-05","","cookies/axeptio/accept-all.spec.ts","",""
"","43379","Un utilisateur ne peut pas désactiver l'authentification à deux facteurs avec un code incorrect","local_desktop_nonReg","2026-03-05","passed","2026-03-05","","authentication/two-factor/bad-code-deactivate.spec.ts","",""
"","46617","Un utilisateur est automatiquement déconnecté après l'expiration de sa session","local_desktop_nonReg","2026-03-05","passed","2026-03-05","","authentication/session/session-timeout-logout.spec.ts","",""
"","55298","Un utilisateur peut activer et désactiver l'authentification à deux facteurs avec succès","local_desktop_nonReg","2026-03-05","passed","2026-03-05","","authentication/two-factor/back-and-forth.spec.ts","",""
"","141293","Un utilisateur non approuvé ne peut pas créer de plan famille et voit un message d'erreur approprié","local_desktop_nonReg","2026-03-05","passed","2026-03-05","","investment/family-plan.spec.ts","",""
"","38289","Le formulaire de réinitialisation du mot de passe affiche les messages d'erreur appropriés en cas de données invalides","local_desktop_nonReg","2026-03-05","passed","2026-03-05","","authentication/reset-password/form-validations.spec.ts","",""
"","19189","La page de connexion avec des erreurs de formulaire respecte les règles d'accessibilité","local_desktop_nonReg","2026-03-05","passed","2026-03-05","","authentication/sign-in/axe-scan-errors.spec.ts","",""
"","37999","Un utilisateur peut réactiver sa session après une expiration temporaire sans être redirigé vers la page de connexion","local_desktop_nonReg","2026-03-05","passed","2026-03-05","","authentication/session/session-timeout-reactivate.spec.ts","",""
"","34292","Un utilisateur est redirigé vers son profil après connexion via /profile/identity","local_desktop_nonReg","2026-03-05","passed","2026-03-05","","authentication/sign-in/redirections.spec.ts","",""
"","12534","Un utilisateur peut refuser les cookies et la modale se ferme","local_desktop_nonReg","2026-03-05","passed","2026-03-05","","cookies/axeptio/refuse-all.spec.ts","",""
"","122841","Un utilisateur ne peut pas se connecter avec un mot de passe incorrect","local_desktop_nonReg","2026-03-05","passed","2026-03-05","","authentication/sign-in/wrong-password.spec.ts","",""
"","40081","La modale de trading se ferme correctement lorsque l'utilisateur annule","local_desktop_nonReg","2026-03-05","passed","2026-03-05","","trading/buy-cryptos.spec.ts","",""
"","34140","Un utilisateur est redirigé vers le dashboard après connexion via /dashboard","local_desktop_nonReg","2026-03-05","passed","2026-03-05","","authentication/sign-in/redirections.spec.ts","",""
"","28251","La page d'inscription B2B (entreprise) respecte les règles d'accessibilité (axe-core)","local_desktop_nonReg","2026-03-05","passed","2026-03-05","","onboarding/accessibility.spec.ts","",""
"","101724","Un utilisateur est vérouillé après plusieurs tentatives de connexion infructueuses","local_desktop_nonReg","2026-03-05","passed","2026-03-05","","authentication/locked-account/nominal.spec.ts","",""
"","22311","La page de choix du type de compte respecte les règles d'accessibilité (axe-core)","local_desktop_nonReg","2026-03-05","passed","2026-03-05","","onboarding/accessibility.spec.ts","",""
"","25954","Un utilisateur peut créer un token API avec succès","local_desktop_nonReg","2026-03-05","passed","2026-03-05","","connections/api-tokens/create-nominal.spec.ts","",""
"","51303","Le portefeuille respecte les règles d'accessibilité (axe-core)","local_desktop_nonReg","2026-03-05","passed","2026-03-05","","trading/accessibility.spec.ts","",""
"","46163","Un utilisateur peut échanger du BTC contre de l'USDC avec succès","local_desktop_nonReg","2026-03-05","failed","2026-03-05","","trading/swap-cryptos.spec.ts","",""
"","34586","La page d'historique est accessible et affiche les onglets de transactions","local_desktop_nonReg","2026-03-05","failed","2026-03-05","","history/transactions-history/transaction-history.spec.ts","",""
"","6260","Le lien 'Gérer vos cookies' du footer ouvre la modale Axeptio","local_desktop_nonReg","2026-03-05","passed","2026-03-05","","cookies/axeptio/open-from-footer.spec.ts","",""
"","23638","Un utilisateur peut naviguer du dashboard vers la vente d'ETH via la fiche crypto","local_desktop_nonReg","2026-03-05","passed","2026-03-05","","navigation/to-sell/dashboard-to-eth-sell.spec.ts","",""
"","49517","Le dashboard respecte les règles d'accessibilité (axe-core)","local_desktop_nonReg","2026-03-05","passed","2026-03-05","","trading/accessibility.spec.ts","",""
"","31913","Un utilisateur est redirigé vers le dépôt EUR après connexion via /deposit/EUR","local_desktop_nonReg","2026-03-05","passed","2026-03-05","","authentication/sign-in/redirections.spec.ts","",""
"","20660","Un utilisateur ne peut pas se connecter avec un email non enregistré","local_desktop_nonReg","2026-03-05","passed","2026-03-05","","authentication/sign-in/unregistered.spec.ts","",""
"","207127","Un Utilisateur B2C peut compléter le flow d'onboarding avec succès","local_desktop_nonReg","2026-03-05","passed","2026-03-05","","onboarding/complete-flows.spec.ts","",""
"","30024","Le composant de swap (achat/vente/conversion) affiche les valeurs de prévisualisation correctes avant la confirmation","local_desktop_nonReg","2026-03-05","passed","2026-03-05","","trading/swap-overlay.spec.ts","",""
"","40791","L'onglet Retraits affiche les retraits avec les informations attendues","local_desktop_nonReg","2026-03-05","failed","2026-03-05","","history/transactions-history/transaction-history.spec.ts","",""
"","34375","Un utilisateur est redirigé vers le wallet après connexion via /wallet","local_desktop_nonReg","2026-03-05","passed","2026-03-05","","authentication/sign-in/redirections.spec.ts","",""
"","23756","Un utilisateur peut accéder aux détails d'une crypto et naviguer vers achat/vente/dépôt/retrait depuis la fiche crypto","local_desktop_nonReg","2026-03-05","failed","2026-03-05","","navigation/in-app/dashboard-market-list.spec.ts","",""
"","180467","Le formulaire de changement de mot de passe affiche les messages d'erreur appropriés en cas de données invalides","local_desktop_nonReg","2026-03-05","passed","2026-03-05","","account/change-password/form-validations.spec.ts","",""
"","23160","La page de connexion respecte les règles d'accessibilité (axe-core)","local_desktop_nonReg","2026-03-05","passed","2026-03-05","","authentication/sign-in/axe-scan.spec.ts","",""
"","21461","Un utilisateur peut acheter de l'ETH via le compte de trading avec succès","local_desktop_nonReg","2026-03-05","failed","2026-03-05","","trading/buy-cryptos.spec.ts","",""
"","117777","Le formulaire de réinitialisation du mot de passe affiche un message de succès même si l'email n'est pas enregistré (obfuscation)","local_desktop_nonReg","2026-03-05","passed","2026-03-05","","authentication/reset-password/unregistered.spec.ts","",""
"","25792","Un utilisateur peut échanger de l'USDC contre de l'ETH avec succès","local_desktop_nonReg","2026-03-05","failed","2026-03-05","","trading/swap-cryptos.spec.ts","",""
"","34786","L'historique des exports précédents est visible avec les boutons de téléchargement","local_desktop_nonReg","2026-03-05","passed","2026-03-05","","history/exports/export.spec.ts","",""
"","30715","Un utilisateur peut échanger de l'USDC contre du BTC avec succès","local_desktop_nonReg","2026-03-05","failed","2026-03-05","","trading/swap-cryptos.spec.ts","",""
"","29783","Un utilisateur peut naviguer du dashboard vers la vente d'USDC via la fiche crypto","local_desktop_nonReg","2026-03-05","passed","2026-03-05","","navigation/to-sell/dashboard-to-usdc-sell.spec.ts","",""
"","30585","La page d'export est accessible depuis l'historique et affiche le formulaire","local_desktop_nonReg","2026-03-05","passed","2026-03-05","","history/exports/export.spec.ts","",""
"","27485","Un utilisateur peut naviguer du dashboard vers la vente de BTC via la fiche crypto","local_desktop_nonReg","2026-03-05","passed","2026-03-05","","navigation/to-sell/dashboard-to-btc-sell.spec.ts","",""
"","44162","Le formulaire de retrait affiche les messages d'erreur appropriés en cas de données invalides","local_desktop_nonReg","2026-03-05","passed","2026-03-05","","transfers/withdraw.spec.ts","",""
"","23491","Un utilisateur peut acheter du BTC via le compte de trading avec succès","local_desktop_nonReg","2026-03-05","passed","2026-03-05","","trading/buy-cryptos.spec.ts","",""
"","27803","Un utilisateur ne peut pas initier un retrait de cryptomonnaies s'il n'a pas d'adresse de retrait enregistrée","local_desktop_nonReg","2026-03-05","passed","2026-03-05","","transfers/deposit.spec.ts","",""
"","40368","Un utilisateur peut prévisualiser un bouton marchand une fois créé","local_desktop_nonReg","2026-03-05","passed","2026-03-05","","connections/merchant-buttons/preview.spec.ts","",""
"","53531","Un utilisateur peut accéder aux écrans d'achat, vente, dépôt et retrait via les boutons rapides du dashboard","local_desktop_nonReg","2026-03-05","passed","2026-03-05","","navigation/in-app/dashboard-quick-actions.spec.ts","",""
"","133825","Un utilisateur peut ajouter un compte bancaire avec succès","local_desktop_nonReg","2026-03-05","passed","2026-03-05","","wallet/bank-account.spec.ts","",""
"","52379","La page de présentation du Plan Bitcoin Famille est accessible et affiche les informations clés à un utilisateur non connecté","local_desktop_nonReg","2026-03-05","passed","2026-03-05","","investment/family-plan.spec.ts","",""
"","32841","Un utilisateur voit un message d'erreur lorsque le paiement par carte échoue","local_desktop_nonReg","2026-03-05","passed","2026-03-05","","trading/buy-cryptos.spec.ts","",""
"","29752","Un utilisateur peut vendre du BTC avec succès","local_desktop_nonReg","2026-03-05","passed","2026-03-05","","trading/sell-cryptos.spec.ts","",""
"","21798","Un utilisateur peut acheter de l'ETH via une nouvelle carte de paiement avec succès","local_desktop_nonReg","2026-03-05","failed","2026-03-05","","trading/buy-cryptos.spec.ts","",""
"","81162","Un utilisateur peut générer un nouvel export de transactions","local_desktop_nonReg","2026-03-05","passed","2026-03-05","","history/exports/export.spec.ts","",""
"","33175","Un utilisateur peut échanger du BTC contre de l'ETH avec succès","local_desktop_nonReg","2026-03-05","failed","2026-03-05","","trading/swap-cryptos.spec.ts","",""
"","19273","Un utilisateur peut naviguer entre les onglets achat, vente et échange","local_desktop_nonReg","2026-03-05","passed","2026-03-05","","trading/swap-overlay.spec.ts","",""
"","54499","Un utilisateur peut acheter du BTC au marché avec succès","local_desktop_nonReg","2026-03-05","failed","2026-03-05","","trading/expert-mode.spec.ts","",""
"","53482","Un utilisateur peut retirer des cryptomonnaies de son compte avec succès","local_desktop_nonReg","2026-03-05","failed","2026-03-05","","transfers/withdraw.spec.ts","",""
"","125038","Un utilisateur ne peut pas activer l'authentification à deux facteurs avec un code incorrect","local_desktop_nonReg","2026-03-05","passed","2026-03-05","","authentication/two-factor/bad-code-activation.spec.ts","",""
