"DESCRIPTION","DURATION IN MS","NAME","PARENT SUITE","START TIME","STATUS","STOP TIME","SUB SUITE","SUITE","TEST CLASS","TEST METHOD"
"","48330","Un utilisateur peut effectuer un transfert interne entre ses comptes deposit->trading avec succès","local_desktop_nonReg","2026-03-05","failed","2026-03-05","","transfers/internal-transfer.spec.ts","",""
"","19123","Un utilisateur peut se déconnecter avec succès","local_desktop_nonReg","2026-03-05","passed","2026-03-05","","authentication/sign-out/nominal.spec.ts","",""
"","22808","Un utilisateur peut naviguer et soumettre le formulaire de connexion au clavier","local_desktop_nonReg","2026-03-05","passed","2026-03-05","","authentication/sign-in/keyboard-navigation.spec.ts","",""
"","20602","Un utilisateur sans paramètre redirect est redirigé vers le dashboard par défaut après connexion","local_desktop_nonReg","2026-03-05","passed","2026-03-05","","authentication/sign-in/redirections.spec.ts","",""
"","31630","Un utilisateur ne peut pas changer son mot de passe avec un mot de passe actuel incorrect","local_desktop_nonReg","2026-03-05","passed","2026-03-05","","account/change-password/bad-current-password.spec.ts","",""
"","29730","Un utilisateur peut échanger de l'USDC contre du BTC avec succès","local_desktop_nonReg","2026-03-05","failed","2026-03-05","","trading/swap-cryptos.spec.ts","",""
"","42620","Un utilisateur ne peut pas désactiver l'authentification à deux facteurs avec un code incorrect","local_desktop_nonReg","2026-03-05","passed","2026-03-05","","authentication/two-factor/bad-code-deactivate.spec.ts","",""
"","35635","Un utilisateur peut supprimer un token API avec succès","local_desktop_nonReg","2026-03-05","failed","2026-03-05","","connections/api-tokens/delete-nominal.spec.ts","",""
"","31434","Le formulaire de création de bouton marchand affiche les messages d'erreur appropriés en cas de données invalides","local_desktop_nonReg","2026-03-05","passed","2026-03-05","","connections/merchant-buttons/create-nominal.spec.ts","",""
"","119170","Le formulaire de réinitialisation du mot de passe affiche les messages d'erreur appropriés en cas de données invalides","local_desktop_nonReg","2026-03-05","passed","2026-03-05","","authentication/reset-password/form-validations.spec.ts","",""
"","27234","La page d'export est accessible depuis l'historique et affiche le formulaire","local_desktop_nonReg","2026-03-05","passed","2026-03-05","","history/exports/export.spec.ts","",""
"","30166","Un utilisateur peut naviguer entre les onglets achat, vente et échange","local_desktop_nonReg","2026-03-05","passed","2026-03-05","","trading/swap-overlay.spec.ts","",""
"","19134","Un utilisateur est redirigé vers le dépôt EUR après connexion via /deposit/EUR","local_desktop_nonReg","2026-03-05","passed","2026-03-05","","authentication/sign-in/redirections.spec.ts","",""
"","194262","Un utilisateur peut créer un ticket de support, ajouter un commentaire, puis fermer le ticket","local_desktop_nonReg","2026-03-05","passed","2026-03-05","","support/support-tickets.spec.ts","",""
"","57459","Un utilisateur peut retirer des cryptomonnaies de son compte avec succès","local_desktop_nonReg","2026-03-05","failed","2026-03-05","","transfers/withdraw.spec.ts","",""
"","21731","Un utilisateur est redirigé vers le dashboard après connexion via /dashboard","local_desktop_nonReg","2026-03-05","passed","2026-03-05","","authentication/sign-in/redirections.spec.ts","",""
"","50388","Le formulaire de retrait affiche les messages d'erreur appropriés en cas de données invalides","local_desktop_nonReg","2026-03-05","passed","2026-03-05","","transfers/withdraw.spec.ts","",""
"","38017","Un utilisateur peut créer, éditer, mettre en pause, reprendre et stopper un DCA","local_desktop_nonReg","2026-03-05","failed","2026-03-05","","investment/dca.spec.ts","",""
"","22275","Un utilisateur peut créer un token API avec succès","local_desktop_nonReg","2026-03-05","passed","2026-03-05","","connections/api-tokens/create-nominal.spec.ts","",""
"","37241","La page d'historique est accessible et affiche les onglets de transactions","local_desktop_nonReg","2026-03-05","failed","2026-03-05","","history/transactions-history/transaction-history.spec.ts","",""
"","74585","Un utilisateur non authentifié est redirigé vers la page de connexion lorsqu'il tente d'accéder aux routes protégées","local_desktop_nonReg","2026-03-05","passed","2026-03-05","","authentication/protected-routes/unauthenticated-access.spec.ts","",""
"","25630","Un utilisateur ne peut pas initier un retrait de cryptomonnaies s'il n'a pas d'adresse de retrait enregistrée","local_desktop_nonReg","2026-03-05","passed","2026-03-05","","transfers/deposit.spec.ts","",""
"","41581","Un utilisateur peut changer son mot de passe avec succès","local_desktop_nonReg","2026-03-05","passed","2026-03-05","","account/change-password/nominal.spec.ts","",""
"","15136","Un utilisateur non authentifié peut accéder aux routes publiques sans être redirigé vers la page de connexion","local_desktop_nonReg","2026-03-05","passed","2026-03-05","","authentication/public-routes/unauthenticated-access.spec.ts","",""
"","27342","La page d'inscription B2B (entreprise) respecte les règles d'accessibilité (axe-core)","local_desktop_nonReg","2026-03-05","passed","2026-03-05","","onboarding/accessibility.spec.ts","",""
"","26941","Un utilisateur peut naviguer du dashboard vers l'achat d'ETH via la fiche crypto","local_desktop_nonReg","2026-03-05","failed","2026-03-05","","navigation/to-buy/dashboard-to-eth-buy.spec.ts","",""
"","16084","Un utilisateur peut se connecter avec des identifiants valides et sans 2FA","local_desktop_nonReg","2026-03-05","passed","2026-03-05","","authentication/sign-in/nominal.spec.ts","",""
"","27012","Un utilisateur peut acheter de l'ETH via le compte de trading avec succès","local_desktop_nonReg","2026-03-05","failed","2026-03-05","","trading/buy-cryptos.spec.ts","",""
"","183802","Un utilisateur peut acheter du BTC via une nouvelle carte de paiement avec succès","local_desktop_nonReg","2026-03-05","failed","2026-03-05","","trading/buy-cryptos.spec.ts","",""
"","11247","Le formulaire de connexion affiche les messages d'erreur appropriés en cas de données invalides","local_desktop_nonReg","2026-03-05","passed","2026-03-05","","authentication/sign-in/form-validations.spec.ts","",""
"","60631","Le formulaire de réinitialisation du mot de passe affiche un message de succès même si l'email n'est pas enregistré (obfuscation)","local_desktop_nonReg","2026-03-05","passed","2026-03-05","","authentication/reset-password/unregistered.spec.ts","",""
"","70210","Un utilisateur peut générer un nouvel export de transactions","local_desktop_nonReg","2026-03-05","passed","2026-03-05","","history/exports/export.spec.ts","",""
"","15879","La page de connexion respecte les règles d'accessibilité (axe-core)","local_desktop_nonReg","2026-03-05","passed","2026-03-05","","authentication/sign-in/axe-scan.spec.ts","",""
"","55865","Un utilisateur voit un message d'erreur lorsque le paiement par carte échoue","local_desktop_nonReg","2026-03-05","passed","2026-03-05","","trading/buy-cryptos.spec.ts","",""
"","20958","Le formulaire de création de token API affiche les messages d'erreur appropriés en cas de données invalides","local_desktop_nonReg","2026-03-05","passed","2026-03-05","","connections/api-tokens/create-form-validations.spec.ts","",""
"","8792","Un utilisateur peut refuser les cookies et la modale se ferme","local_desktop_nonReg","2026-03-05","passed","2026-03-05","","cookies/axeptio/refuse-all.spec.ts","",""
"","22698","Un utilisateur est redirigé vers le wallet après connexion via /wallet","local_desktop_nonReg","2026-03-05","passed","2026-03-05","","authentication/sign-in/redirections.spec.ts","",""
"","37051","Un utilisateur peut envoyer des euros à un destinataire via son adresse email avec succès","local_desktop_nonReg","2026-03-05","passed","2026-03-05","","transfers/send-by-email.spec.ts","",""
"","34531","Un utilisateur peut acheter du BTC via le compte de trading avec succès","local_desktop_nonReg","2026-03-05","passed","2026-03-05","","trading/buy-cryptos.spec.ts","",""
"","24214","Un utilisateur peut naviguer du dashboard vers l'achat d'USDC via la fiche crypto","local_desktop_nonReg","2026-03-05","failed","2026-03-05","","navigation/to-buy/dashboard-to-usdc-buy.spec.ts","",""
"","24393","Un utilisateur peut échanger de l'ETH contre de l'USDC avec succès","local_desktop_nonReg","2026-03-05","failed","2026-03-05","","trading/swap-cryptos.spec.ts","",""
"","20060","Un utilisateur peut accéder aux détails d'une crypto et naviguer vers achat/vente/dépôt/retrait depuis la fiche crypto","local_desktop_nonReg","2026-03-05","failed","2026-03-05","","navigation/in-app/dashboard-market-list.spec.ts","",""
"","36821","L'onglet Ordres affiche les ordres avec les informations attendues","local_desktop_nonReg","2026-03-05","failed","2026-03-05","","history/transactions-history/transaction-history.spec.ts","",""
"","24907","Un utilisateur peut vendre de l'ETH avec succès","local_desktop_nonReg","2026-03-05","failed","2026-03-05","","trading/sell-cryptos.spec.ts","",""
"","71034","Un utilisateur peut annuler un ordre actif BTC avec succès","local_desktop_nonReg","2026-03-05","failed","2026-03-05","","trading/expert-mode.spec.ts","",""
"","43147","La page de présentation du Plan Bitcoin Famille est accessible et affiche les informations clés","local_desktop_nonReg","2026-03-05","passed","2026-03-05","","investment/family-plan.spec.ts","",""
"","561","Un utilisateur peut naviguer vers les principales sections du site via le menu responsive","local_desktop_nonReg","2026-03-05","skipped","2026-03-05","","navigation/in-app/responsive-menu.spec.ts","",""
"","25918","Un utilisateur est automatiquement déconnecté après l'expiration de sa session","local_desktop_nonReg","2026-03-05","passed","2026-03-05","","authentication/session/session-timeout-logout.spec.ts","",""
"","34897","Le composant de swap (achat/vente/conversion) affiche les valeurs de prévisualisation correctes avant la confirmation","local_desktop_nonReg","2026-03-05","passed","2026-03-05","","trading/swap-overlay.spec.ts","",""
"","22362","Un utilisateur peut réactiver sa session après une expiration temporaire sans être redirigé vers la page de connexion","local_desktop_nonReg","2026-03-05","passed","2026-03-05","","authentication/session/session-timeout-reactivate.spec.ts","",""
"","35664","Un utilisateur peut accéder aux écrans d'achat, vente, dépôt et retrait via les boutons rapides du dashboard","local_desktop_nonReg","2026-03-05","passed","2026-03-05","","navigation/in-app/dashboard-quick-actions.spec.ts","",""
"","75605","Un utilisateur peut naviguer vers les principales sections du site via la barre de navigation","local_desktop_nonReg","2026-03-05","failed","2026-03-05","","navigation/in-app/web-navbar.spec.ts","",""
"","27705","Un utilisateur peut échanger du BTC contre de l'ETH avec succès","local_desktop_nonReg","2026-03-05","failed","2026-03-05","","trading/swap-cryptos.spec.ts","",""
"","15369","La page de connexion avec des erreurs de formulaire respecte les règles d'accessibilité","local_desktop_nonReg","2026-03-05","passed","2026-03-05","","authentication/sign-in/axe-scan-errors.spec.ts","",""
"","22139","Un utilisateur peut vendre du BTC avec succès","local_desktop_nonReg","2026-03-05","passed","2026-03-05","","trading/sell-cryptos.spec.ts","",""
"","23202","Un utilisateur peut naviguer du dashboard vers la vente de BTC via la fiche crypto","local_desktop_nonReg","2026-03-05","passed","2026-03-05","","navigation/to-sell/dashboard-to-btc-sell.spec.ts","",""
"","230923","Un utilisateur peut réinitialiser son mot de passe avec succès via le lien envoyé par email","local_desktop_nonReg","2026-03-05","passed","2026-03-05","","authentication/reset-password/nominal.spec.ts","",""
"","49337","Un utilisateur peut vendre du BTC en ordre limite avec succès","local_desktop_nonReg","2026-03-05","failed","2026-03-05","","trading/expert-mode.spec.ts","",""
"","36706","La page d'inscription B2C (email) respecte les règles d'accessibilité (axe-core)","local_desktop_nonReg","2026-03-05","passed","2026-03-05","","onboarding/accessibility.spec.ts","",""
"","24369","Un utilisateur peut supprimer un bouton marchand avec succès","local_desktop_nonReg","2026-03-05","passed","2026-03-05","","connections/merchant-buttons/delete.spec.ts","",""
"","10006","Un utilisateur peut accepter tous les cookies et la modale se ferme","local_desktop_nonReg","2026-03-05","passed","2026-03-05","","cookies/axeptio/accept-all.spec.ts","",""
"","178051","Un utilisateur peut activer et désactiver l'authentification à deux facteurs avec succès","local_desktop_nonReg","2026-03-05","passed","2026-03-05","","authentication/two-factor/back-and-forth.spec.ts","",""
"","50058","La page de présentation du Plan Bitcoin Famille est accessible et affiche les informations clés à un utilisateur non connecté","local_desktop_nonReg","2026-03-05","passed","2026-03-05","","investment/family-plan.spec.ts","",""
"","86433","Un utilisateur peut ajouter un compte bancaire avec succès","local_desktop_nonReg","2026-03-05","passed","2026-03-05","","wallet/bank-account.spec.ts","",""
"","33659","La page de choix du type de compte respecte les règles d'accessibilité (axe-core)","local_desktop_nonReg","2026-03-05","passed","2026-03-05","","onboarding/accessibility.spec.ts","",""
"","21782","Un utilisateur non approuvé est redirigé vers la page d'onboarding incomplète après connexion","local_desktop_nonReg","2026-03-05","passed","2026-03-05","","authentication/sign-in/resume-onboarding.spec.ts","",""
"","26705","Un utilisateur peut vendre de l'USDC avec succès","local_desktop_nonReg","2026-03-05","failed","2026-03-05","","trading/sell-cryptos.spec.ts","",""
"","58831","Un utilisateur peut ajouter une adresse de retrait BTC avec succès","local_desktop_nonReg","2026-03-05","failed","2026-03-05","","wallet/crypto-address.spec.ts","",""
"","96987","Un utilisateur peut déposer des euros sur son compte via Open Banking avec succès","local_desktop_nonReg","2026-03-05","passed","2026-03-05","","transfers/deposit.spec.ts","",""
"","24206","Un utilisateur peut échanger de l'ETH contre du BTC avec succès","local_desktop_nonReg","2026-03-05","failed","2026-03-05","","trading/swap-cryptos.spec.ts","",""
"","58187","Un utilisateur peut vendre du BTC au marché avec succès","local_desktop_nonReg","2026-03-05","failed","2026-03-05","","trading/expert-mode.spec.ts","",""
"","76770","Un utilisateur ne peut pas activer l'authentification à deux facteurs avec un code incorrect","local_desktop_nonReg","2026-03-05","passed","2026-03-05","","authentication/two-factor/bad-code-activation.spec.ts","",""
"","26779","Un utilisateur peut prévisualiser un bouton marchand une fois créé","local_desktop_nonReg","2026-03-05","passed","2026-03-05","","connections/merchant-buttons/preview.spec.ts","",""
"","28820","Un utilisateur peut échanger du BTC contre de l'USDC avec succès","local_desktop_nonReg","2026-03-05","failed","2026-03-05","","trading/swap-cryptos.spec.ts","",""
"","28676","Un utilisateur peut naviguer du dashboard vers l'achat de BTC via la fiche crypto","local_desktop_nonReg","2026-03-05","failed","2026-03-05","","navigation/to-buy/dashboard-to-btc-buy.spec.ts","",""
"","39591","Le portefeuille respecte les règles d'accessibilité (axe-core)","local_desktop_nonReg","2026-03-05","passed","2026-03-05","","trading/accessibility.spec.ts","",""
"","69353","Un utilisateur ne peut pas se connecter avec un mot de passe incorrect","local_desktop_nonReg","2026-03-05","passed","2026-03-05","","authentication/sign-in/wrong-password.spec.ts","",""
"","21148","Un utilisateur ne peut pas créer un token API avec un mot de passe incorrect","local_desktop_nonReg","2026-03-05","passed","2026-03-05","","connections/api-tokens/create-bad-password.spec.ts","",""
"","42123","Un utilisateur peut retirer des euros de son compte avec succès","local_desktop_nonReg","2026-03-05","failed","2026-03-05","","transfers/withdraw.spec.ts","",""
"","49879","Un utilisateur non approuvé ne peut pas initier un retrait et voit un message d'erreur approprié","local_desktop_nonReg","2026-03-05","passed","2026-03-05","","transfers/withdraw.notApproved.spec.ts","",""
"","241891","Un Utilisateur B2C peut compléter le flow d'onboarding avec succès","local_desktop_nonReg","2026-03-05","passed","2026-03-05","","onboarding/complete-flows.spec.ts","",""
"","27206","Un utilisateur peut acheter de l'USDC via le compte de trading avec succès","local_desktop_nonReg","2026-03-05","failed","2026-03-05","","trading/buy-cryptos.spec.ts","",""
"","27137","Un utilisateur peut naviguer vers les principales sections du site via le menu utilisateur","local_desktop_nonReg","2026-03-05","passed","2026-03-05","","navigation/in-app/user-menu.spec.ts","",""
"","45964","Un utilisateur peut effectuer un transfert interne entre ses comptes trading->deposit avec succès","local_desktop_nonReg","2026-03-05","failed","2026-03-05","","transfers/internal-transfer.spec.ts","",""
"","273869","Un Utilisateur B2B peut compléter le flow d'onboarding avec succès","local_desktop_nonReg","2026-03-05","passed","2026-03-05","","onboarding/complete-flows.spec.ts","",""
"","83039","Le mode expert respecte les règles d'accessibilité (axe-core)","local_desktop_nonReg","2026-03-05","passed","2026-03-05","","trading/accessibility.spec.ts","",""
"","29787","La page d'achat/vente respecte les règles d'accessibilité (axe-core)","local_desktop_nonReg","2026-03-05","passed","2026-03-05","","trading/accessibility.spec.ts","",""
"","50444","Un utilisateur peut acheter du BTC au marché avec succès","local_desktop_nonReg","2026-03-05","failed","2026-03-05","","trading/expert-mode.spec.ts","",""
"","18844","Un utilisateur est redirigé vers son profil après connexion via /profile/identity","local_desktop_nonReg","2026-03-05","passed","2026-03-05","","authentication/sign-in/redirections.spec.ts","",""
"","184578","Un utilisateur est vérouillé après plusieurs tentatives de connexion infructueuses","local_desktop_nonReg","2026-03-05","passed","2026-03-05","","authentication/locked-account/nominal.spec.ts","",""
"","59695","La modale de trading se ferme correctement lorsque l'utilisateur annule","local_desktop_nonReg","2026-03-05","passed","2026-03-05","","trading/buy-cryptos.spec.ts","",""
"","13698","Un utilisateur ne peut pas se connecter avec un email non enregistré","local_desktop_nonReg","2026-03-05","passed","2026-03-05","","authentication/sign-in/unregistered.spec.ts","",""
"","31010","Un utilisateur peut naviguer du dashboard vers la vente d'ETH via la fiche crypto","local_desktop_nonReg","2026-03-05","passed","2026-03-05","","navigation/to-sell/dashboard-to-eth-sell.spec.ts","",""
"","37432","Un utilisateur peut déposer des cryptomonnaies sur son compte avec succès","local_desktop_nonReg","2026-03-05","passed","2026-03-05","","transfers/deposit.spec.ts","",""
"","30986","Un utilisateur peut ajouter un portefeuille non hébergé avec succès","local_desktop_nonReg","2026-03-05","passed","2026-03-05","","wallet/unhosted-wallets.spec.ts","",""
"","55458","Le formulaire d'achat de cryptomonnaies affiche les messages d'erreur appropriés en cas de données invalides","local_desktop_nonReg","2026-03-05","passed","2026-03-05","","trading/buy-cryptos.spec.ts","",""
"","37227","L'onglet Retraits affiche les retraits avec les informations attendues","local_desktop_nonReg","2026-03-05","failed","2026-03-05","","history/transactions-history/transaction-history.spec.ts","",""
"","120841","Le formulaire de changement de mot de passe affiche les messages d'erreur appropriés en cas de données invalides","local_desktop_nonReg","2026-03-05","passed","2026-03-05","","account/change-password/form-validations.spec.ts","",""
"","26455","Un utilisateur peut acheter de l'ETH via une nouvelle carte de paiement avec succès","local_desktop_nonReg","2026-03-05","failed","2026-03-05","","trading/buy-cryptos.spec.ts","",""
"","16960","Le lien 'Gérer vos cookies' du footer ouvre la modale Axeptio","local_desktop_nonReg","2026-03-05","passed","2026-03-05","","cookies/axeptio/open-from-footer.spec.ts","",""
"","32458","Un utilisateur peut échanger de l'USDC contre de l'ETH avec succès","local_desktop_nonReg","2026-03-05","failed","2026-03-05","","trading/swap-cryptos.spec.ts","",""
"","32989","Un utilisateur peut naviguer du dashboard vers la vente d'USDC via la fiche crypto","local_desktop_nonReg","2026-03-05","passed","2026-03-05","","navigation/to-sell/dashboard-to-usdc-sell.spec.ts","",""
"","40592","Un utilisateur peut naviguer entre les onglets de l'historique","local_desktop_nonReg","2026-03-05","failed","2026-03-05","","history/transactions-history/transaction-history.spec.ts","",""
"","581875","Un utilisateur non approuvé ne peut pas créer de plan famille et voit un message d'erreur approprié","local_desktop_nonReg","2026-03-05","passed","2026-03-05","","investment/family-plan.spec.ts","",""
"","37885","Un utilisateur peut envoyer des cryptomonnaies à un destinataire via son adresse email avec succès","local_desktop_nonReg","2026-03-05","passed","2026-03-05","","transfers/send-by-email.spec.ts","",""
"","22823","Le formulaire de création de bouton marchand affiche les messages d'erreur appropriés en cas de données invalides","local_desktop_nonReg","2026-03-05","passed","2026-03-05","","connections/merchant-buttons/create-form-validations.spec.ts","",""
"","23351","La déconnexion dans un onglet invalide la session dans un autre onglet","local_desktop_nonReg","2026-03-05","passed","2026-03-05","","authentication/session/multi-sessions-invalidate.spec.ts","",""
"","33403","Le dashboard respecte les règles d'accessibilité (axe-core)","local_desktop_nonReg","2026-03-05","passed","2026-03-05","","trading/accessibility.spec.ts","",""
"","326336","Un utilisateur avec l'authentification à deux facteurs activée ne peut pas se connecter avec un code 2FA incorrect","local_desktop_nonReg","2026-03-05","passed","2026-03-05","","authentication/two-factor/bad-code-login.spec.ts","",""
"","30201","L'historique des exports précédents est visible avec les boutons de téléchargement","local_desktop_nonReg","2026-03-05","passed","2026-03-05","","history/exports/export.spec.ts","",""
"","79535","Un utilisateur peut acheter du BTC en ordre limite avec succès","local_desktop_nonReg","2026-03-05","failed","2026-03-05","","trading/expert-mode.spec.ts","",""
