"DESCRIPTION","DURATION IN MS","NAME","PARENT SUITE","START TIME","STATUS","STOP TIME","SUB SUITE","SUITE","TEST CLASS","TEST METHOD"
"","4366","Un utilisateur peut accéder à la page de réinitialisation du mot de passe depuis la page de connexion","local_nonReg","2026-02-19","passed","2026-02-19","","authentication/sign-in.spec.ts","",""
"","24980","Un utilisateur peut acheter du BTC en ordre limite avec succès","local_nonReg","2026-02-19","failed","2026-02-19","","trading/expert-mode.spec.ts","",""
"","4546","Un utilisateur peut réactiver sa session après une expiration temporaire sans être redirigé vers la page de connexion","local_nonReg","2026-02-19","failed","2026-02-19","","authentication/session-timeout.spec.ts","",""
"","28427","Un utilisateur peut naviguer vers les principales sections du site via le menu responsive","local_nonReg","2026-02-19","failed","2026-02-19","","navigation/responsive.spec.ts","",""
"","22859","Un utilisateur peut effectuer un transfert interne entre ses comptes deposit->trading avec succès","local_nonReg","2026-02-19","failed","2026-02-19","","transfers/internal-transfer.spec.ts","",""
"","22797","Un utilisateur peut échanger de l'ETH contre du BTC avec succès","local_nonReg","2026-02-19","failed","2026-02-19","","trading/swap-cryptos.spec.ts","",""
"","22594","Un utilisateur peut ajouter un portefeuille non hébergé avec succès","local_nonReg","2026-02-19","failed","2026-02-19","","wallet/unhosted-wallets.spec.ts","",""
"","22818","Un utilisateur peut échanger de l'ETH contre de l'USDC avec succès","local_nonReg","2026-02-19","failed","2026-02-19","","trading/swap-cryptos.spec.ts","",""
"","25011","Un utilisateur peut acheter du BTC via le compte de trading avec succès","local_nonReg","2026-02-19","failed","2026-02-19","","trading/buy-cryptos.spec.ts","",""
"","23200","Un utilisateur peut vendre du BTC avec succès","local_nonReg","2026-02-19","failed","2026-02-19","","trading/sell-cryptos.spec.ts","",""
"","6613","Le formulaire de réinitialisation du mot de passe affiche un message de succès même si l'email n'est pas enregistré (obfuscation)","local_nonReg","2026-02-19","passed","2026-02-19","","authentication/reset-password.spec.ts","",""
"","15441","Cycle de vie d'un DCA et validations des formulaires","local_nonReg","2026-02-19","failed","2026-02-19","","investment/dca.spec.ts","",""
"","2369","(clean) BTC Withdrawal Addresses","local_clean","2026-02-19","passed","2026-02-19","","_clean/cleanTestAccount.clean.ts","",""
"","25971","Lien approvisionnement et Formulaire","local_nonReg","2026-02-19","failed","2026-02-19","","trading/buy-cryptos.spec.ts","",""
"","33148","Le formulaire de retrait affiche les messages d'erreur appropriés en cas de données invalides","local_nonReg","2026-02-19","failed","2026-02-19","","transfers/withdraw.spec.ts","",""
"","31199","Un utilisateur non approuvé ne peut pas initier un retrait et voit un message d'erreur approprié","local_nonReg","2026-02-19","failed","2026-02-19","","transfers/withdraw.notApproved.spec.ts","",""
"","23112","Un utilisateur peut vendre de l'USDC avec succès","local_nonReg","2026-02-19","failed","2026-02-19","","trading/sell-cryptos.spec.ts","",""
"","23684","Un utilisateur peut se déconnecter avec succès","local_nonReg","2026-02-19","failed","2026-02-19","","authentication/sign-out.spec.ts","",""
"","22968","Un utilisateur peut vendre de l'ETH avec succès","local_nonReg","2026-02-19","failed","2026-02-19","","trading/sell-cryptos.spec.ts","",""
"","24785","(auth.setup) utilisateur approuvé avec 2FA","local_setup","2026-02-19","passed","2026-02-19","","_setup/authAndCookies.setup.ts","",""
"","22864","Un utilisateur peut échanger du BTC contre de l'ETH avec succès","local_nonReg","2026-02-19","failed","2026-02-19","","trading/swap-cryptos.spec.ts","",""
"","2409","(clean) BTC DCA","local_clean","2026-02-19","passed","2026-02-19","","_clean/cleanTestAccount.clean.ts","",""
"","24706","Un utilisateur peut acheter du BTC au marché avec succès","local_nonReg","2026-02-19","failed","2026-02-19","","trading/expert-mode.spec.ts","",""
"","12398","(setup) cookies accepté","local_setup","2026-02-19","passed","2026-02-19","","_setup/authAndCookies.setup.ts","",""
"","5","(clean) tickets de support","local_clean","2026-02-19","skipped","2026-02-19","","_clean/cleanTestAccount.clean.ts","",""
"","11170","Un utilisateur avec un compte verrouillé voit un message d'erreur approprié lors de la tentative de connexion","local_nonReg","2026-02-19","passed","2026-02-19","","authentication/sign-in.spec.ts","",""
"","22965","Un utilisateur peut effectuer un transfert interne entre ses comptes trading->deposit avec succès","local_nonReg","2026-02-19","failed","2026-02-19","","transfers/internal-transfer.spec.ts","",""
"","32855","Un utilisateur peut retirer des cryptomonnaies de son compte avec succès","local_nonReg","2026-02-19","failed","2026-02-19","","transfers/withdraw.spec.ts","",""
"","25796","Un Utilisateur B2B peut compléter le flow d'onboarding avec succès","local_nonReg","2026-02-19","failed","2026-02-19","","onboarding/complete-flows.spec.ts","",""
"","23542","Un utilisateur peut vendre du BTC au marché avec succès","local_nonReg","2026-02-19","failed","2026-02-19","","trading/expert-mode.spec.ts","",""
"","24045","Un utilisateur peut acheter de l'ETH via une nouvelle carte de paiement avec succès","local_nonReg","2026-02-19","failed","2026-02-19","","trading/buy-cryptos.spec.ts","",""
"","162500","Un utilisateur est vérouillé après plusieurs tentatives de connexion infructueuses","local_nonReg","2026-02-19","failed","2026-02-19","","authentication/locked-account.spec.ts","",""
"","12846","Un utilisateur peut ajouter une adresse de retrait BTC avec succès","local_nonReg","2026-02-19","failed","2026-02-19","","wallet/crypto-address.spec.ts","",""
"","22790","Un utilisateur peut échanger du BTC contre de l'USDC avec succès","local_nonReg","2026-02-19","failed","2026-02-19","","trading/swap-cryptos.spec.ts","",""
"","68715","Un utilisateur peut créer un ticket de support, ajouter un commentaire, puis fermer le ticket","local_nonReg","2026-02-19","failed","2026-02-19","","support/support-tickets.spec.ts","",""
"","8233","Un utilisateur ne peut pas se connecter avec un email non enregistré","local_nonReg","2026-02-19","passed","2026-02-19","","authentication/sign-in.spec.ts","",""
"","25638","Un utilisateur peut acheter de l'ETH via le compte de trading avec succès","local_nonReg","2026-02-19","failed","2026-02-19","","trading/buy-cryptos.spec.ts","",""
"","22732","Un utilisateur ne peut pas initier un retrait de cryptomonnaies s'il n'a pas d'adresse de retrait enregistrée","local_nonReg","2026-02-19","failed","2026-02-19","","transfers/deposit.spec.ts","",""
"","37731","Un utilisateur non approuvé est redirigé vers la page d'onboarding incomplète après connexion","local_nonReg","2026-02-19","failed","2026-02-19","","authentication/sign-in.spec.ts","",""
"","22132","Un utilisateur peut se connecter avec des identifiants valides et 2FA activée","local_nonReg","2026-02-19","failed","2026-02-19","","authentication/sign-in.spec.ts","",""
"","22960","Le formulaire d'achat de cryptomonnaies affiche les messages d'erreur appropriés en cas de données invalides","local_nonReg","2026-02-19","failed","2026-02-19","","trading/buy-cryptos.spec.ts","",""
"","5739","Le formulaire de réinitialisation du mot de passe affiche les messages d'erreur appropriés en cas de données invalides","local_nonReg","2026-02-19","passed","2026-02-19","","authentication/reset-password.spec.ts","",""
"","56874","Un utilisateur peut réinitialiser son mot de passe avec succès via le lien envoyé par email","local_nonReg","2026-02-19","failed","2026-02-19","","authentication/reset-password.spec.ts","",""
"","570790","Un utilisateur peut activer et désactiver l'authentification à deux facteurs avec succès","local_nonReg","2026-02-19","failed","2026-02-19","","authentication/two-factor-auth.spec.ts","",""
"","22865","Un utilisateur peut échanger de l'USDC contre du BTC avec succès","local_nonReg","2026-02-19","failed","2026-02-19","","trading/swap-cryptos.spec.ts","",""
"","243837","La page de présentation du Plan Bitcoin Famille est accessible et affiche les informations clés","local_nonReg","2026-02-19","passed","2026-02-19","","investment/family-plan.spec.ts","",""
"","234575","Un Utilisateur B2C peut compléter le flow d'onboarding avec succès","local_nonReg","2026-02-19","passed","2026-02-19","","onboarding/complete-flows.spec.ts","",""
"","25942","Un utilisateur peut vendre du BTC en ordre limite avec succès","local_nonReg","2026-02-19","failed","2026-02-19","","trading/expert-mode.spec.ts","",""
"","22806","Un utilisateur peut déposer des euros sur son compte via Open Banking avec succès","local_nonReg","2026-02-19","failed","2026-02-19","","transfers/deposit.spec.ts","",""
"","68288","Un utilisateur ne peut pas se connecter avec un mot de passe incorrect","local_nonReg","2026-02-19","failed","2026-02-19","","authentication/sign-in.spec.ts","",""
"","5255","Un utilisateur est automatiquement déconnecté après l'expiration de sa session","local_nonReg","2026-02-19","failed","2026-02-19","","authentication/session-timeout.spec.ts","",""
"","7162","La page de présentation du Plan Bitcoin Famille est accessible et affiche les informations clés à un utilisateur non connecté","local_nonReg","2026-02-19","passed","2026-02-19","","investment/family-plan.spec.ts","",""
"","5143","Le formulaire de connexion affiche les messages d'erreur appropriés en cas de données invalides","local_nonReg","2026-02-19","passed","2026-02-19","","authentication/sign-in.spec.ts","",""
"","21389","Un utilisateur peut se connecter avec des identifiants valides et sans 2FA","local_nonReg","2026-02-19","failed","2026-02-19","","authentication/sign-in.spec.ts","",""
"","4258","Un utilisateur peut accéder à la page d'inscription depuis la page de connexion","local_nonReg","2026-02-19","passed","2026-02-19","","authentication/sign-in.spec.ts","",""
"","23188","Un utilisateur peut envoyer des cryptomonnaies à un destinataire via son adresse email avec succès","local_nonReg","2026-02-19","failed","2026-02-19","","transfers/send-by-email.spec.ts","",""
"","23911","Un utilisateur peut acheter du BTC via une nouvelle carte de paiement avec succès","local_nonReg","2026-02-19","failed","2026-02-19","","trading/buy-cryptos.spec.ts","",""
"","6340","Un utilisateur non authentifié est redirigé vers la page de connexion lorsqu'il tente d'accéder à une route protégée","local_nonReg","2026-02-19","passed","2026-02-19","","authentication/potected-routes.spec.ts","",""
"","22985","Un utilisateur peut échanger de l'USDC contre de l'ETH avec succès","local_nonReg","2026-02-19","failed","2026-02-19","","trading/swap-cryptos.spec.ts","",""
"","70789","Un utilisateur non approuvé ne peut pas créer de plan famille et voit un message d'erreur approprié","local_nonReg","2026-02-19","failed","2026-02-19","","investment/family-plan.spec.ts","",""
"","121452","Un utilisateur peut changer son mot de passe avec succès","local_nonReg","2026-02-19","broken","2026-02-19","","account/change-password.spec.ts","",""
