"DESCRIPTION","DURATION IN MS","NAME","PARENT SUITE","START TIME","STATUS","STOP TIME","SUB SUITE","SUITE","TEST CLASS","TEST METHOD"
"","319282","Un utilisateur peut changer son mot de passe avec succès","local_nonReg","2026-02-18","passed","2026-02-18","","account/change-password.spec.ts","",""
"","8767","Un utilisateur peut échanger de l'ETH contre du BTC avec succès","local_nonReg","2026-02-18","passed","2026-02-18","","trading/swap-cryptos.spec.ts","",""
"","11237","Un utilisateur peut ajouter un portefeuille non hébergé avec succès","local_nonReg","2026-02-18","passed","2026-02-18","","wallet/unhosted-wallets.spec.ts","",""
"","17893","Un utilisateur peut acheter de l'ETH via une nouvelle carte de paiement avec succès","local_nonReg","2026-02-18","passed","2026-02-18","","trading/buy-cryptos.spec.ts","",""
"","25430","Un utilisateur peut effectuer un transfert interne entre ses comptes trading->deposit avec succès","local_nonReg","2026-02-18","failed","2026-02-18","","transfers/internal-transfer.spec.ts","",""
"","7033","Un utilisateur non authentifié est redirigé vers la page de connexion lorsqu'il tente d'accéder à une route protégée","local_nonReg","2026-02-18","passed","2026-02-18","","authentication/potected-routes.spec.ts","",""
"","89857","Un utilisateur peut réinitialiser son mot de passe avec succès via le lien envoyé par email","local_nonReg","2026-02-18","passed","2026-02-18","","authentication/reset-password.spec.ts","",""
"","9055","Un utilisateur peut échanger de l'USDC contre du BTC avec succès","local_nonReg","2026-02-18","passed","2026-02-18","","trading/swap-cryptos.spec.ts","",""
"","21337","Le formulaire de retrait affiche les messages d'erreur appropriés en cas de données invalides","local_nonReg","2026-02-18","passed","2026-02-18","","transfers/withdraw.spec.ts","",""
"","9697","Un utilisateur peut acheter de l'ETH via le compte de trading avec succès","local_nonReg","2026-02-18","passed","2026-02-18","","trading/buy-cryptos.spec.ts","",""
"","8167","(setup) cookies accepté","local_setup","2026-02-18","passed","2026-02-18","","_setup/authAndCookies.setup.ts","",""
"","19898","Un utilisateur peut envoyer des cryptomonnaies à un destinataire via son adresse email avec succès","local_nonReg","2026-02-18","passed","2026-02-18","","transfers/send-by-email.spec.ts","",""
"","7123","Un utilisateur peut vendre de l'ETH avec succès","local_nonReg","2026-02-18","passed","2026-02-18","","trading/sell-cryptos.spec.ts","",""
"","42322","Un utilisateur non approuvé est redirigé vers la page d'onboarding incomplète après connexion","local_nonReg","2026-02-18","passed","2026-02-18","","authentication/sign-in.spec.ts","",""
"","25675","Un utilisateur peut effectuer un transfert interne entre ses comptes deposit->trading avec succès","local_nonReg","2026-02-18","failed","2026-02-18","","transfers/internal-transfer.spec.ts","",""
"","23579","Un utilisateur peut acheter du BTC en ordre limite avec succès","local_nonReg","2026-02-18","passed","2026-02-18","","trading/expert-mode.spec.ts","",""
"","344948","Un utilisateur non approuvé ne peut pas créer de plan famille et voit un message d'erreur approprié","local_nonReg","2026-02-18","passed","2026-02-18","","investment/family-plan.spec.ts","",""
"","273918","Un Utilisateur B2B peut compléter le flow d'onboarding avec succès","local_nonReg","2026-02-18","failed","2026-02-18","","onboarding/complete-flows.spec.ts","",""
"","5535","Le formulaire de réinitialisation du mot de passe affiche un message de succès même si l'email n'est pas enregistré (obfuscation)","local_nonReg","2026-02-18","passed","2026-02-18","","authentication/reset-password.spec.ts","",""
"","26778","Cycle de vie d'un DCA et validations des formulaires","local_nonReg","2026-02-18","passed","2026-02-18","","investment/dca.spec.ts","",""
"","3689","(clean) BTC Withdrawal Addresses","local_clean","2026-02-18","passed","2026-02-18","","_clean/cleanTestAccount.clean.ts","",""
"","4818","Lien approvisionnement et Formulaire","local_nonReg","2026-02-18","passed","2026-02-18","","trading/buy-cryptos.spec.ts","",""
"","14669","Un utilisateur peut échanger du BTC contre de l'ETH avec succès","local_nonReg","2026-02-18","passed","2026-02-18","","trading/swap-cryptos.spec.ts","",""
"","56630","Un utilisateur peut acheter du BTC au marché avec succès","local_nonReg","2026-02-18","failed","2026-02-18","","trading/expert-mode.spec.ts","",""
"","8115","Un utilisateur ne peut pas initier un retrait de cryptomonnaies s'il n'a pas d'adresse de retrait enregistrée","local_nonReg","2026-02-18","passed","2026-02-18","","transfers/deposit.spec.ts","",""
"","9142","Un utilisateur peut échanger de l'USDC contre de l'ETH avec succès","local_nonReg","2026-02-18","passed","2026-02-18","","trading/swap-cryptos.spec.ts","",""
"","3775","Un utilisateur peut accéder à la page d'inscription depuis la page de connexion","local_nonReg","2026-02-18","passed","2026-02-18","","authentication/sign-in.spec.ts","",""
"","253867","Un utilisateur est vérouillé après plusieurs tentatives de connexion infructueuses","local_nonReg","2026-02-18","passed","2026-02-18","","authentication/locked-account.spec.ts","",""
"","10736","Un utilisateur peut se connecter avec des identifiants valides et 2FA activée","local_nonReg","2026-02-18","passed","2026-02-18","","authentication/sign-in.spec.ts","",""
"","7163","Un utilisateur avec un compte verrouillé voit un message d'erreur approprié lors de la tentative de connexion","local_nonReg","2026-02-18","passed","2026-02-18","","authentication/sign-in.spec.ts","",""
"","9954","Un utilisateur peut se connecter avec des identifiants valides et sans 2FA","local_nonReg","2026-02-18","passed","2026-02-18","","authentication/sign-in.spec.ts","",""
"","8280","Un utilisateur peut réactiver sa session après une expiration temporaire sans être redirigé vers la page de connexion","local_nonReg","2026-02-18","passed","2026-02-18","","authentication/session-timeout.spec.ts","",""
"","18023","Barre de navigation principale","local_nonReg","2026-02-18","passed","2026-02-18","","navigation/navbar.spec.ts","",""
"","60191","Un utilisateur peut créer un ticket de support, ajouter un commentaire, puis fermer le ticket","local_nonReg","2026-02-18","failed","2026-02-18","","support/support-tickets.spec.ts","",""
"","10561","Le formulaire d'achat de cryptomonnaies affiche les messages d'erreur appropriés en cas de données invalides","local_nonReg","2026-02-18","passed","2026-02-18","","trading/buy-cryptos.spec.ts","",""
"","112980","La page de présentation du Plan Bitcoin Famille est accessible et affiche les informations clés","local_nonReg","2026-02-18","passed","2026-02-18","","investment/family-plan.spec.ts","",""
"","4892","Un utilisateur peut se déconnecter avec succès","local_nonReg","2026-02-18","passed","2026-02-18","","authentication/sign-out.spec.ts","",""
"","10893","Un utilisateur est automatiquement déconnecté après l'expiration de sa session","local_nonReg","2026-02-18","passed","2026-02-18","","authentication/session-timeout.spec.ts","",""
"","3138","Un utilisateur peut accéder à la page de réinitialisation du mot de passe depuis la page de connexion","local_nonReg","2026-02-18","passed","2026-02-18","","authentication/sign-in.spec.ts","",""
"","117522","Un utilisateur non approuvé ne peut pas initier un retrait et voit un message d'erreur approprié","local_nonReg","2026-02-18","passed","2026-02-18","","transfers/withdraw.notApproved.spec.ts","",""
"","5822","Un utilisateur peut vendre du BTC avec succès","local_nonReg","2026-02-18","passed","2026-02-18","","trading/sell-cryptos.spec.ts","",""
"","10066","Un utilisateur peut échanger de l'ETH contre de l'USDC avec succès","local_nonReg","2026-02-18","passed","2026-02-18","","trading/swap-cryptos.spec.ts","",""
"","41176","Un Utilisateur B2C peut compléter le flow d'onboarding avec succès","local_nonReg","2026-02-18","passed","2026-02-18","","onboarding/complete-flows.spec.ts","",""
"","3399","La page de présentation du Plan Bitcoin Famille est accessible et affiche les informations clés à un utilisateur non connecté","local_nonReg","2026-02-18","passed","2026-02-18","","investment/family-plan.spec.ts","",""
"","6572","Un utilisateur ne peut pas se connecter avec un email non enregistré","local_nonReg","2026-02-18","passed","2026-02-18","","authentication/sign-in.spec.ts","",""
"","16156","Un utilisateur peut échanger du BTC contre de l'USDC avec succès","local_nonReg","2026-02-18","failed","2026-02-18","","trading/swap-cryptos.spec.ts","",""
"","46198","Un utilisateur peut vendre du BTC au marché avec succès","local_nonReg","2026-02-18","failed","2026-02-18","","trading/expert-mode.spec.ts","",""
"","8059","Un utilisateur peut vendre de l'USDC avec succès","local_nonReg","2026-02-18","passed","2026-02-18","","trading/sell-cryptos.spec.ts","",""
"","20159","Un utilisateur peut acheter du BTC via une nouvelle carte de paiement avec succès","local_nonReg","2026-02-18","passed","2026-02-18","","trading/buy-cryptos.spec.ts","",""
"","8451","Un utilisateur peut acheter du BTC via le compte de trading avec succès","local_nonReg","2026-02-18","passed","2026-02-18","","trading/buy-cryptos.spec.ts","",""
"","33474","Un utilisateur peut déposer des euros sur son compte via Open Banking avec succès","local_nonReg","2026-02-18","passed","2026-02-18","","transfers/deposit.spec.ts","",""
"","35860","Un utilisateur peut ajouter une adresse de retrait BTC avec succès","local_nonReg","2026-02-18","passed","2026-02-18","","wallet/crypto-address.spec.ts","",""
"","66968","Un utilisateur peut vendre du BTC en ordre limite avec succès","local_nonReg","2026-02-18","failed","2026-02-18","","trading/expert-mode.spec.ts","",""
"","2085","(clean) BTC DCA","local_clean","2026-02-18","passed","2026-02-18","","_clean/cleanTestAccount.clean.ts","",""
"","15778","(auth.setup) utilisateur approuvé avec 2FA","local_setup","2026-02-18","passed","2026-02-18","","_setup/authAndCookies.setup.ts","",""
"","3651","Le formulaire de connexion affiche les messages d'erreur appropriés en cas de données invalides","local_nonReg","2026-02-18","passed","2026-02-18","","authentication/sign-in.spec.ts","",""
"","17237","Un utilisateur ne peut pas se connecter avec un mot de passe incorrect","local_nonReg","2026-02-18","passed","2026-02-18","","authentication/sign-in.spec.ts","",""
"","14515","Un utilisateur peut naviguer vers les principales sections du site via le menu utilisateur","local_nonReg","2026-02-18","passed","2026-02-18","","navigation/user-menu.spec.ts","",""
"","3","(clean) tickets de support","local_clean","2026-02-18","skipped","2026-02-18","","_clean/cleanTestAccount.clean.ts","",""
"","17132","Un utilisateur peut retirer des cryptomonnaies de son compte avec succès","local_nonReg","2026-02-18","failed","2026-02-18","","transfers/withdraw.spec.ts","",""
"","6887","Le formulaire de réinitialisation du mot de passe affiche les messages d'erreur appropriés en cas de données invalides","local_nonReg","2026-02-18","passed","2026-02-18","","authentication/reset-password.spec.ts","",""
"","101692","Un utilisateur peut activer et désactiver l'authentification à deux facteurs avec succès","local_nonReg","2026-02-18","passed","2026-02-18","","authentication/two-factor-auth.spec.ts","",""
