"DESCRIPTION","DURATION IN MS","NAME","PARENT SUITE","START TIME","STATUS","STOP TIME","SUB SUITE","SUITE","TEST CLASS","TEST METHOD"
"","25518","La page de présentation du Plan Bitcoin Famille est accessible et affiche les informations clés","flux_nonReg","2026-02-19","passed","2026-02-19","","investment/family-plan.spec.ts","",""
"","26845","Un utilisateur peut échanger de l'USDC contre du BTC avec succès","flux_nonReg","2026-02-19","passed","2026-02-19","","trading/swap-cryptos.spec.ts","",""
"","2","(clean) tickets de support","flux_clean","2026-02-19","skipped","2026-02-19","","_clean/cleanTestAccount.clean.ts","",""
"","5697","Le formulaire de réinitialisation du mot de passe affiche les messages d'erreur appropriés en cas de données invalides","flux_nonReg","2026-02-19","passed","2026-02-19","","authentication/reset-password.spec.ts","",""
"","25503","Le formulaire de retrait affiche les messages d'erreur appropriés en cas de données invalides","flux_nonReg","2026-02-19","passed","2026-02-19","","transfers/withdraw.spec.ts","",""
"","8259","Un utilisateur peut se déconnecter avec succès","flux_nonReg","2026-02-19","passed","2026-02-19","","authentication/sign-out.spec.ts","",""
"","43905","Un utilisateur peut naviguer vers les principales sections du site via le menu responsive","flux_nonReg","2026-02-19","passed","2026-02-19","","navigation/responsive.spec.ts","",""
"","40541","Cycle de vie d'un DCA et validations des formulaires","flux_nonReg","2026-02-19","failed","2026-02-19","","investment/dca.spec.ts","",""
"","26549","Un utilisateur peut échanger de l'ETH contre du BTC avec succès","flux_nonReg","2026-02-19","passed","2026-02-19","","trading/swap-cryptos.spec.ts","",""
"","38371","Un utilisateur peut effectuer un transfert interne entre ses comptes trading->deposit avec succès","flux_nonReg","2026-02-19","failed","2026-02-19","","transfers/internal-transfer.spec.ts","",""
"","31728","Un utilisateur peut effectuer un transfert interne entre ses comptes deposit->trading avec succès","flux_nonReg","2026-02-19","failed","2026-02-19","","transfers/internal-transfer.spec.ts","",""
"","40649","Un utilisateur non approuvé ne peut pas créer de plan famille et voit un message d'erreur approprié","flux_nonReg","2026-02-19","passed","2026-02-19","","investment/family-plan.spec.ts","",""
"","29638","Un utilisateur peut retirer des cryptomonnaies de son compte avec succès","flux_nonReg","2026-02-19","failed","2026-02-19","","transfers/withdraw.spec.ts","",""
"","23861","Un utilisateur peut échanger de l'ETH contre de l'USDC avec succès","flux_nonReg","2026-02-19","passed","2026-02-19","","trading/swap-cryptos.spec.ts","",""
"","23461","Un Utilisateur B2B peut compléter le flow d'onboarding avec succès","flux_nonReg","2026-02-19","failed","2026-02-19","","onboarding/complete-flows.spec.ts","",""
"","36411","Un utilisateur peut envoyer des cryptomonnaies à un destinataire via son adresse email avec succès","flux_nonReg","2026-02-19","passed","2026-02-19","","transfers/send-by-email.spec.ts","",""
"","39086","Un utilisateur peut créer un ticket de support, ajouter un commentaire, puis fermer le ticket","flux_nonReg","2026-02-19","passed","2026-02-19","","support/support-tickets.spec.ts","",""
"","41380","Un utilisateur peut acheter de l'ETH via une nouvelle carte de paiement avec succès","flux_nonReg","2026-02-19","failed","2026-02-19","","trading/buy-cryptos.spec.ts","",""
"","43401","Un utilisateur non approuvé est redirigé vers la page d'onboarding incomplète après connexion","flux_nonReg","2026-02-19","passed","2026-02-19","","authentication/sign-in.spec.ts","",""
"","12585","Un utilisateur peut acheter du BTC via le compte de trading avec succès","flux_nonReg","2026-02-19","passed","2026-02-19","","trading/buy-cryptos.spec.ts","",""
"","21787","Lien approvisionnement et Formulaire","flux_nonReg","2026-02-19","failed","2026-02-19","","trading/buy-cryptos.spec.ts","",""
"","35968","Un utilisateur peut vendre du BTC en ordre limite avec succès","flux_nonReg","2026-02-19","failed","2026-02-19","","trading/expert-mode.spec.ts","",""
"","18969","Un utilisateur peut vendre de l'USDC avec succès","flux_nonReg","2026-02-19","passed","2026-02-19","","trading/sell-cryptos.spec.ts","",""
"","6285","Le formulaire de réinitialisation du mot de passe affiche un message de succès même si l'email n'est pas enregistré (obfuscation)","flux_nonReg","2026-02-19","passed","2026-02-19","","authentication/reset-password.spec.ts","",""
"","2033","(clean) BTC Withdrawal Addresses","flux_clean","2026-02-19","passed","2026-02-19","","_clean/cleanTestAccount.clean.ts","",""
"","19443","Un utilisateur peut acheter de l'ETH via le compte de trading avec succès","flux_nonReg","2026-02-19","passed","2026-02-19","","trading/buy-cryptos.spec.ts","",""
"","34838","Un utilisateur non approuvé ne peut pas initier un retrait et voit un message d'erreur approprié","flux_nonReg","2026-02-19","passed","2026-02-19","","transfers/withdraw.notApproved.spec.ts","",""
"","18344","Un utilisateur peut ajouter un portefeuille non hébergé avec succès","flux_nonReg","2026-02-19","passed","2026-02-19","","wallet/unhosted-wallets.spec.ts","",""
"","6418","Le formulaire de connexion affiche les messages d'erreur appropriés en cas de données invalides","flux_nonReg","2026-02-19","passed","2026-02-19","","authentication/sign-in.spec.ts","",""
"","39756","Un utilisateur peut acheter du BTC en ordre limite avec succès","flux_nonReg","2026-02-19","failed","2026-02-19","","trading/expert-mode.spec.ts","",""
"","8619","(setup) cookies accepté","flux_setup","2026-02-19","passed","2026-02-19","","_setup/authAndCookies.setup.ts","",""
"","14848","Un utilisateur peut vendre du BTC avec succès","flux_nonReg","2026-02-19","passed","2026-02-19","","trading/sell-cryptos.spec.ts","",""
"","44029","Un utilisateur peut acheter du BTC via une nouvelle carte de paiement avec succès","flux_nonReg","2026-02-19","failed","2026-02-19","","trading/buy-cryptos.spec.ts","",""
"","25189","Un utilisateur peut échanger du BTC contre de l'ETH avec succès","flux_nonReg","2026-02-19","passed","2026-02-19","","trading/swap-cryptos.spec.ts","",""
"","77712","Un utilisateur est vérouillé après plusieurs tentatives de connexion infructueuses","flux_nonReg","2026-02-19","passed","2026-02-19","","authentication/locked-account.spec.ts","",""
"","9784","Un utilisateur peut réactiver sa session après une expiration temporaire sans être redirigé vers la page de connexion","flux_nonReg","2026-02-19","passed","2026-02-19","","authentication/session-timeout.spec.ts","",""
"","12952","Un utilisateur peut se connecter avec des identifiants valides et sans 2FA","flux_nonReg","2026-02-19","passed","2026-02-19","","authentication/sign-in.spec.ts","",""
"","43302","Un utilisateur peut changer son mot de passe avec succès","flux_nonReg","2026-02-19","passed","2026-02-19","","account/change-password.spec.ts","",""
"","14717","Un utilisateur peut se connecter avec des identifiants valides et 2FA activée","flux_nonReg","2026-02-19","passed","2026-02-19","","authentication/sign-in.spec.ts","",""
"","8945","Un utilisateur ne peut pas se connecter avec un email non enregistré","flux_nonReg","2026-02-19","passed","2026-02-19","","authentication/sign-in.spec.ts","",""
"","48868","Un utilisateur peut ajouter une adresse de retrait BTC avec succès","flux_nonReg","2026-02-19","passed","2026-02-19","","wallet/crypto-address.spec.ts","",""
"","133273","Un utilisateur peut réinitialiser son mot de passe avec succès via le lien envoyé par email","flux_nonReg","2026-02-19","passed","2026-02-19","","authentication/reset-password.spec.ts","",""
"","32697","Un utilisateur peut acheter du BTC au marché avec succès","flux_nonReg","2026-02-19","failed","2026-02-19","","trading/expert-mode.spec.ts","",""
"","19065","Un utilisateur peut vendre de l'ETH avec succès","flux_nonReg","2026-02-19","passed","2026-02-19","","trading/sell-cryptos.spec.ts","",""
"","7266","Un utilisateur avec un compte verrouillé voit un message d'erreur approprié lors de la tentative de connexion","flux_nonReg","2026-02-19","passed","2026-02-19","","authentication/sign-in.spec.ts","",""
"","181225","Un utilisateur peut activer et désactiver l'authentification à deux facteurs avec succès","flux_nonReg","2026-02-19","passed","2026-02-19","","authentication/two-factor-auth.spec.ts","",""
"","28760","Un utilisateur peut vendre du BTC au marché avec succès","flux_nonReg","2026-02-19","failed","2026-02-19","","trading/expert-mode.spec.ts","",""
"","619127","Un utilisateur ne peut pas se connecter avec un mot de passe incorrect","flux_nonReg","2026-02-19","passed","2026-02-19","","authentication/sign-in.spec.ts","",""
"","25810","Un utilisateur peut échanger de l'USDC contre de l'ETH avec succès","flux_nonReg","2026-02-19","passed","2026-02-19","","trading/swap-cryptos.spec.ts","",""
"","27685","Un utilisateur ne peut pas initier un retrait de cryptomonnaies s'il n'a pas d'adresse de retrait enregistrée","flux_nonReg","2026-02-19","passed","2026-02-19","","transfers/deposit.spec.ts","",""
"","4022","La page de présentation du Plan Bitcoin Famille est accessible et affiche les informations clés à un utilisateur non connecté","flux_nonReg","2026-02-19","passed","2026-02-19","","investment/family-plan.spec.ts","",""
"","15730","Le formulaire d'achat de cryptomonnaies affiche les messages d'erreur appropriés en cas de données invalides","flux_nonReg","2026-02-19","passed","2026-02-19","","trading/buy-cryptos.spec.ts","",""
"","6027","Un utilisateur non authentifié est redirigé vers la page de connexion lorsqu'il tente d'accéder à une route protégée","flux_nonReg","2026-02-19","passed","2026-02-19","","authentication/potected-routes.spec.ts","",""
"","18224","Un utilisateur peut échanger du BTC contre de l'USDC avec succès","flux_nonReg","2026-02-19","failed","2026-02-19","","trading/swap-cryptos.spec.ts","",""
"","15907","(auth.setup) utilisateur approuvé avec 2FA","flux_setup","2026-02-19","passed","2026-02-19","","_setup/authAndCookies.setup.ts","",""
"","4608","Un utilisateur peut accéder à la page d'inscription depuis la page de connexion","flux_nonReg","2026-02-19","passed","2026-02-19","","authentication/sign-in.spec.ts","",""
"","2176","(clean) BTC DCA","flux_clean","2026-02-19","passed","2026-02-19","","_clean/cleanTestAccount.clean.ts","",""
"","43846","Un Utilisateur B2C peut compléter le flow d'onboarding avec succès","flux_nonReg","2026-02-19","passed","2026-02-19","","onboarding/complete-flows.spec.ts","",""
"","79430","Un utilisateur peut déposer des euros sur son compte via Open Banking avec succès","flux_nonReg","2026-02-19","failed","2026-02-19","","transfers/deposit.spec.ts","",""
"","4204","Un utilisateur peut accéder à la page de réinitialisation du mot de passe depuis la page de connexion","flux_nonReg","2026-02-19","passed","2026-02-19","","authentication/sign-in.spec.ts","",""
"","14106","Un utilisateur est automatiquement déconnecté après l'expiration de sa session","flux_nonReg","2026-02-19","passed","2026-02-19","","authentication/session-timeout.spec.ts","",""
