"DESCRIPTION","DURATION IN MS","NAME","PARENT SUITE","START TIME","STATUS","STOP TIME","SUB SUITE","SUITE","TEST CLASS","TEST METHOD"
"","22229","Un utilisateur voit un message d'erreur lorsque le paiement par carte échoue","sandbox_desktop_nonReg","2026-03-06","passed","2026-03-06","","trading/buy-cryptos.spec.ts","",""
"","223776","Un Utilisateur B2B peut compléter le flow d'onboarding avec succès","sandbox_desktop_nonReg","2026-03-06","passed","2026-03-06","","onboarding/complete-flows.spec.ts","",""
"","51075","Un utilisateur peut retirer des euros de son compte avec succès","sandbox_desktop_nonReg","2026-03-06","failed","2026-03-06","","transfers/withdraw.spec.ts","",""
"","17826","L'onglet Ordres affiche les ordres avec les informations attendues","sandbox_desktop_nonReg","2026-03-06","passed","2026-03-06","","history/transactions-history/transaction-history.spec.ts","",""
"","62839","Un utilisateur peut ajouter une adresse de retrait BTC avec succès","sandbox_desktop_nonReg","2026-03-06","failed","2026-03-06","","wallet/crypto-address.spec.ts","",""
"","17441","Un utilisateur peut naviguer du dashboard vers la vente d'ETH via la fiche crypto","sandbox_desktop_nonReg","2026-03-06","passed","2026-03-06","","navigation/to-sell/dashboard-to-eth-sell.spec.ts","",""
"","27495","Le composant de swap (achat/vente/conversion) affiche les valeurs de prévisualisation correctes avant la confirmation","sandbox_desktop_nonReg","2026-03-06","passed","2026-03-06","","trading/swap-overlay.spec.ts","",""
"","59188","Un utilisateur peut générer un nouvel export de transactions","sandbox_desktop_nonReg","2026-03-06","passed","2026-03-06","","history/exports/export.spec.ts","",""
"","24079","Un utilisateur peut vendre de l'ETH avec succès","sandbox_desktop_nonReg","2026-03-06","failed","2026-03-06","","trading/sell-cryptos.spec.ts","",""
"","23600","Un utilisateur peut vendre de l'USDC avec succès","sandbox_desktop_nonReg","2026-03-06","failed","2026-03-06","","trading/sell-cryptos.spec.ts","",""
"","133645","Un utilisateur peut créer un ticket de support, ajouter un commentaire, puis fermer le ticket","sandbox_desktop_nonReg","2026-03-06","passed","2026-03-06","","support/support-tickets.spec.ts","",""
"","221743","Un utilisateur ne peut pas activer l'authentification à deux facteurs avec un code incorrect","sandbox_desktop_nonReg","2026-03-06","passed","2026-03-06","","authentication/two-factor/bad-code-activation.spec.ts","",""
"","44170","Le mode expert respecte les règles d'accessibilité (axe-core)","sandbox_desktop_nonReg","2026-03-06","passed","2026-03-06","","trading/accessibility.spec.ts","",""
"","17843","Un utilisateur peut naviguer entre les onglets de l'historique","sandbox_desktop_nonReg","2026-03-06","passed","2026-03-06","","history/transactions-history/transaction-history.spec.ts","",""
"","35037","La page de connexion avec des erreurs de formulaire respecte les règles d'accessibilité","sandbox_desktop_nonReg","2026-03-06","passed","2026-03-06","","authentication/sign-in/axe-scan-errors.spec.ts","",""
"","24306","Le formulaire de création de bouton marchand affiche les messages d'erreur appropriés en cas de données invalides","sandbox_desktop_nonReg","2026-03-06","passed","2026-03-06","","connections/merchant-buttons/create-nominal.spec.ts","",""
"","44097","Un utilisateur peut effectuer un transfert interne entre ses comptes deposit->trading avec succès","sandbox_desktop_nonReg","2026-03-06","failed","2026-03-06","","transfers/internal-transfer.spec.ts","",""
"","103323","Un utilisateur non approuvé ne peut pas initier un retrait et voit un message d'erreur approprié","sandbox_desktop_nonReg","2026-03-06","passed","2026-03-06","","transfers/withdraw.notApproved.spec.ts","",""
"","52602","La page de connexion respecte les règles d'accessibilité (axe-core)","sandbox_desktop_nonReg","2026-03-06","passed","2026-03-06","","authentication/sign-in/axe-scan.spec.ts","",""
"","19555","Un utilisateur peut créer un token API avec succès","sandbox_desktop_nonReg","2026-03-06","passed","2026-03-06","","connections/api-tokens/create-nominal.spec.ts","",""
"","93335","Un utilisateur est redirigé vers le wallet après connexion via /wallet","sandbox_desktop_nonReg","2026-03-06","passed","2026-03-06","","authentication/sign-in/redirections.spec.ts","",""
"","110313","Un utilisateur non authentifié peut accéder aux routes publiques sans être redirigé vers la page de connexion","sandbox_desktop_nonReg","2026-03-06","passed","2026-03-06","","authentication/public-routes/unauthenticated-access.spec.ts","",""
"","45674","Un utilisateur peut ajouter un portefeuille non hébergé avec succès","sandbox_desktop_nonReg","2026-03-06","passed","2026-03-06","","wallet/unhosted-wallets.spec.ts","",""
"","49930","Un utilisateur peut ajouter un compte bancaire avec succès","sandbox_desktop_nonReg","2026-03-06","passed","2026-03-06","","wallet/bank-account.spec.ts","",""
"","27497","Le portefeuille respecte les règles d'accessibilité (axe-core)","sandbox_desktop_nonReg","2026-03-06","passed","2026-03-06","","trading/accessibility.spec.ts","",""
"","18384","Un utilisateur peut acheter du BTC via le compte de trading avec succès","sandbox_desktop_nonReg","2026-03-06","passed","2026-03-06","","trading/buy-cryptos.spec.ts","",""
"","17295","La page d'inscription B2B (entreprise) respecte les règles d'accessibilité (axe-core)","sandbox_desktop_nonReg","2026-03-06","passed","2026-03-06","","onboarding/accessibility.spec.ts","",""
"","173777","Un utilisateur peut acheter du BTC via une nouvelle carte de paiement avec succès","sandbox_desktop_nonReg","2026-03-06","failed","2026-03-06","","trading/buy-cryptos.spec.ts","",""
"","174131","Un utilisateur ne peut pas changer son mot de passe avec un mot de passe actuel incorrect","sandbox_desktop_nonReg","2026-03-06","passed","2026-03-06","","account/change-password/bad-current-password.spec.ts","",""
"","38316","La page de présentation du Plan Bitcoin Famille est accessible et affiche les informations clés à un utilisateur non connecté","sandbox_desktop_nonReg","2026-03-06","passed","2026-03-06","","investment/family-plan.spec.ts","",""
"","28397","Le dashboard respecte les règles d'accessibilité (axe-core)","sandbox_desktop_nonReg","2026-03-06","passed","2026-03-06","","trading/accessibility.spec.ts","",""
"","17524","Un utilisateur peut acheter de l'USDC via le compte de trading avec succès","sandbox_desktop_nonReg","2026-03-06","failed","2026-03-06","","trading/buy-cryptos.spec.ts","",""
"","24500","Un utilisateur peut naviguer entre les onglets achat, vente et échange","sandbox_desktop_nonReg","2026-03-06","passed","2026-03-06","","trading/swap-overlay.spec.ts","",""
"","16427","Un utilisateur peut naviguer du dashboard vers l'achat d'ETH via la fiche crypto","sandbox_desktop_nonReg","2026-03-06","failed","2026-03-06","","navigation/to-buy/dashboard-to-eth-buy.spec.ts","",""
"","18932","L'historique des exports précédents est visible avec les boutons de téléchargement","sandbox_desktop_nonReg","2026-03-06","passed","2026-03-06","","history/exports/export.spec.ts","",""
"","18156","Un utilisateur peut naviguer du dashboard vers la vente d'USDC via la fiche crypto","sandbox_desktop_nonReg","2026-03-06","passed","2026-03-06","","navigation/to-sell/dashboard-to-usdc-sell.spec.ts","",""
"","21660","Le formulaire d'achat de cryptomonnaies affiche les messages d'erreur appropriés en cas de données invalides","sandbox_desktop_nonReg","2026-03-06","passed","2026-03-06","","trading/buy-cryptos.spec.ts","",""
"","18261","Un utilisateur ne peut pas créer un token API avec un mot de passe incorrect","sandbox_desktop_nonReg","2026-03-06","passed","2026-03-06","","connections/api-tokens/create-bad-password.spec.ts","",""
"","3304","Un utilisateur peut refuser les cookies et la modale se ferme","sandbox_desktop_nonReg","2026-03-06","passed","2026-03-06","","cookies/axeptio/refuse-all.spec.ts","",""
"","26652","Le formulaire de réinitialisation du mot de passe affiche un message de succès même si l'email n'est pas enregistré (obfuscation)","sandbox_desktop_nonReg","2026-03-06","passed","2026-03-06","","authentication/reset-password/unregistered.spec.ts","",""
"","25307","La modale de trading se ferme correctement lorsque l'utilisateur annule","sandbox_desktop_nonReg","2026-03-06","passed","2026-03-06","","trading/buy-cryptos.spec.ts","",""
"","19099","Un utilisateur peut naviguer vers les principales sections du site via le menu utilisateur","sandbox_desktop_nonReg","2026-03-06","passed","2026-03-06","","navigation/in-app/user-menu.spec.ts","",""
"","17744","Un utilisateur peut naviguer du dashboard vers l'achat d'USDC via la fiche crypto","sandbox_desktop_nonReg","2026-03-06","failed","2026-03-06","","navigation/to-buy/dashboard-to-usdc-buy.spec.ts","",""
"","27604","Un utilisateur peut échanger de l'ETH contre du BTC avec succès","sandbox_desktop_nonReg","2026-03-06","failed","2026-03-06","","trading/swap-cryptos.spec.ts","",""
"","21597","Un utilisateur ne peut pas initier un retrait de cryptomonnaies s'il n'a pas d'adresse de retrait enregistrée","sandbox_desktop_nonReg","2026-03-06","passed","2026-03-06","","transfers/deposit.spec.ts","",""
"","70469","Un utilisateur peut vendre du BTC en ordre limite avec succès","sandbox_desktop_nonReg","2026-03-06","failed","2026-03-06","","trading/expert-mode.spec.ts","",""
"","114022","Un utilisateur non approuvé ne peut pas créer de plan famille et voit un message d'erreur approprié","sandbox_desktop_nonReg","2026-03-06","passed","2026-03-06","","investment/family-plan.spec.ts","",""
"","105204","Le formulaire de réinitialisation du mot de passe affiche les messages d'erreur appropriés en cas de données invalides","sandbox_desktop_nonReg","2026-03-06","passed","2026-03-06","","authentication/reset-password/form-validations.spec.ts","",""
"","17654","La page d'inscription B2C (email) respecte les règles d'accessibilité (axe-core)","sandbox_desktop_nonReg","2026-03-06","passed","2026-03-06","","onboarding/accessibility.spec.ts","",""
"","33942","Un utilisateur peut échanger du BTC contre de l'USDC avec succès","sandbox_desktop_nonReg","2026-03-06","failed","2026-03-06","","trading/swap-cryptos.spec.ts","",""
"","23679","Un utilisateur peut prévisualiser un bouton marchand une fois créé","sandbox_desktop_nonReg","2026-03-06","passed","2026-03-06","","connections/merchant-buttons/preview.spec.ts","",""
"","234289","Le formulaire de changement de mot de passe affiche les messages d'erreur appropriés en cas de données invalides","sandbox_desktop_nonReg","2026-03-06","passed","2026-03-06","","account/change-password/form-validations.spec.ts","",""
"","38179","Un utilisateur peut envoyer des euros à un destinataire via son adresse email avec succès","sandbox_desktop_nonReg","2026-03-06","passed","2026-03-06","","transfers/send-by-email.spec.ts","",""
"","409434","Un utilisateur peut réinitialiser son mot de passe avec succès via le lien envoyé par email","sandbox_desktop_nonReg","2026-03-06","passed","2026-03-06","","authentication/reset-password/nominal.spec.ts","",""
"","300","Un utilisateur peut naviguer vers les principales sections du site via le menu responsive","sandbox_desktop_nonReg","2026-03-06","skipped","2026-03-06","","navigation/in-app/responsive-menu.spec.ts","",""
"","64740","Un utilisateur est redirigé vers le dashboard après connexion via /dashboard","sandbox_desktop_nonReg","2026-03-06","passed","2026-03-06","","authentication/sign-in/redirections.spec.ts","",""
"","29656","Un utilisateur ne peut pas désactiver l'authentification à deux facteurs avec un code incorrect","sandbox_desktop_nonReg","2026-03-06","passed","2026-03-06","","authentication/two-factor/bad-code-deactivate.spec.ts","",""
"","43913","Un utilisateur ne peut pas se connecter avec un mot de passe incorrect","sandbox_desktop_nonReg","2026-03-06","passed","2026-03-06","","authentication/sign-in/wrong-password.spec.ts","",""
"","43407","Un Utilisateur B2C peut compléter le flow d'onboarding avec succès","sandbox_desktop_nonReg","2026-03-06","passed","2026-03-06","","onboarding/complete-flows.spec.ts","",""
"","37977","Le formulaire de connexion affiche les messages d'erreur appropriés en cas de données invalides","sandbox_desktop_nonReg","2026-03-06","passed","2026-03-06","","authentication/sign-in/form-validations.spec.ts","",""
"","54085","Le formulaire de retrait affiche les messages d'erreur appropriés en cas de données invalides","sandbox_desktop_nonReg","2026-03-06","passed","2026-03-06","","transfers/withdraw.spec.ts","",""
"","16420","La page d'historique est accessible et affiche les onglets de transactions","sandbox_desktop_nonReg","2026-03-06","passed","2026-03-06","","history/transactions-history/transaction-history.spec.ts","",""
"","41592","Un utilisateur ne peut pas se connecter avec un email non enregistré","sandbox_desktop_nonReg","2026-03-06","passed","2026-03-06","","authentication/sign-in/unregistered.spec.ts","",""
"","53330","Un utilisateur peut se déconnecter avec succès","sandbox_desktop_nonReg","2026-03-06","passed","2026-03-06","","authentication/sign-out/nominal.spec.ts","",""
"","155877","Un utilisateur non approuvé est redirigé vers la page d'onboarding incomplète après connexion","sandbox_desktop_nonReg","2026-03-06","passed","2026-03-06","","authentication/sign-in/resume-onboarding.spec.ts","",""
"","29322","Un utilisateur peut supprimer un token API avec succès","sandbox_desktop_nonReg","2026-03-06","failed","2026-03-06","","connections/api-tokens/delete-nominal.spec.ts","",""
"","344698","Un utilisateur non authentifié est redirigé vers la page de connexion lorsqu'il tente d'accéder aux routes protégées","sandbox_desktop_nonReg","2026-03-06","passed","2026-03-06","","authentication/protected-routes/unauthenticated-access.spec.ts","",""
"","17742","Un utilisateur peut acheter de l'ETH via le compte de trading avec succès","sandbox_desktop_nonReg","2026-03-06","failed","2026-03-06","","trading/buy-cryptos.spec.ts","",""
"","16792","Un utilisateur peut naviguer du dashboard vers la vente de BTC via la fiche crypto","sandbox_desktop_nonReg","2026-03-06","passed","2026-03-06","","navigation/to-sell/dashboard-to-btc-sell.spec.ts","",""
"","19183","La page d'export est accessible depuis l'historique et affiche le formulaire","sandbox_desktop_nonReg","2026-03-06","passed","2026-03-06","","history/exports/export.spec.ts","",""
"","25900","Un utilisateur peut échanger du BTC contre de l'ETH avec succès","sandbox_desktop_nonReg","2026-03-06","failed","2026-03-06","","trading/swap-cryptos.spec.ts","",""
"","22885","Un utilisateur peut échanger de l'USDC contre de l'ETH avec succès","sandbox_desktop_nonReg","2026-03-06","failed","2026-03-06","","trading/swap-cryptos.spec.ts","",""
"","22625","Un utilisateur peut déposer des cryptomonnaies sur son compte avec succès","sandbox_desktop_nonReg","2026-03-06","passed","2026-03-06","","transfers/deposit.spec.ts","",""
"","71239","Un utilisateur sans paramètre redirect est redirigé vers le dashboard par défaut après connexion","sandbox_desktop_nonReg","2026-03-06","passed","2026-03-06","","authentication/sign-in/redirections.spec.ts","",""
"","81483","Un utilisateur peut naviguer vers les principales sections du site via la barre de navigation","sandbox_desktop_nonReg","2026-03-06","passed","2026-03-06","","navigation/in-app/web-navbar.spec.ts","",""
"","110498","Un utilisateur est automatiquement déconnecté après l'expiration de sa session","sandbox_desktop_nonReg","2026-03-06","failed","2026-03-06","","authentication/session/session-timeout-logout.spec.ts","",""
"","20860","Un utilisateur peut supprimer un bouton marchand avec succès","sandbox_desktop_nonReg","2026-03-06","passed","2026-03-06","","connections/merchant-buttons/delete.spec.ts","",""
"","66384","Un utilisateur peut retirer des cryptomonnaies de son compte avec succès","sandbox_desktop_nonReg","2026-03-06","failed","2026-03-06","","transfers/withdraw.spec.ts","",""
"","61488","Un utilisateur est redirigé vers son profil après connexion via /profile/identity","sandbox_desktop_nonReg","2026-03-06","passed","2026-03-06","","authentication/sign-in/redirections.spec.ts","",""
"","49123","Un utilisateur peut effectuer un transfert interne entre ses comptes trading->deposit avec succès","sandbox_desktop_nonReg","2026-03-06","failed","2026-03-06","","transfers/internal-transfer.spec.ts","",""
"","48163","Un utilisateur peut acheter du BTC au marché avec succès","sandbox_desktop_nonReg","2026-03-06","failed","2026-03-06","","trading/expert-mode.spec.ts","",""
"","61838","Un utilisateur peut vendre du BTC au marché avec succès","sandbox_desktop_nonReg","2026-03-06","failed","2026-03-06","","trading/expert-mode.spec.ts","",""
"","274120","Un utilisateur est vérouillé après plusieurs tentatives de connexion infructueuses","sandbox_desktop_nonReg","2026-03-06","passed","2026-03-06","","authentication/locked-account/nominal.spec.ts","",""
"","39142","Un utilisateur peut envoyer des cryptomonnaies à un destinataire via son adresse email avec succès","sandbox_desktop_nonReg","2026-03-06","passed","2026-03-06","","transfers/send-by-email.spec.ts","",""
"","17820","Un utilisateur peut acheter de l'ETH via une nouvelle carte de paiement avec succès","sandbox_desktop_nonReg","2026-03-06","failed","2026-03-06","","trading/buy-cryptos.spec.ts","",""
"","55063","Un utilisateur peut créer, éditer, mettre en pause, reprendre et stopper un DCA","sandbox_desktop_nonReg","2026-03-06","passed","2026-03-06","","investment/dca.spec.ts","",""
"","210021","Un utilisateur peut activer et désactiver l'authentification à deux facteurs avec succès","sandbox_desktop_nonReg","2026-03-06","passed","2026-03-06","","authentication/two-factor/back-and-forth.spec.ts","",""
"","31646","La page de présentation du Plan Bitcoin Famille est accessible et affiche les informations clés","sandbox_desktop_nonReg","2026-03-06","passed","2026-03-06","","investment/family-plan.spec.ts","",""
"","4125","Un utilisateur peut accepter tous les cookies et la modale se ferme","sandbox_desktop_nonReg","2026-03-06","passed","2026-03-06","","cookies/axeptio/accept-all.spec.ts","",""
"","26853","Un utilisateur peut échanger de l'ETH contre de l'USDC avec succès","sandbox_desktop_nonReg","2026-03-06","failed","2026-03-06","","trading/swap-cryptos.spec.ts","",""
"","27722","Un utilisateur peut vendre du BTC avec succès","sandbox_desktop_nonReg","2026-03-06","passed","2026-03-06","","trading/sell-cryptos.spec.ts","",""
"","80950","Un utilisateur avec l'authentification à deux facteurs activée ne peut pas se connecter avec un code 2FA incorrect","sandbox_desktop_nonReg","2026-03-06","passed","2026-03-06","","authentication/two-factor/bad-code-login.spec.ts","",""
"","1872","Le lien 'Gérer vos cookies' du footer ouvre la modale Axeptio","sandbox_desktop_nonReg","2026-03-06","passed","2026-03-06","","cookies/axeptio/open-from-footer.spec.ts","",""
"","61620","Un utilisateur peut réactiver sa session après une expiration temporaire sans être redirigé vers la page de connexion","sandbox_desktop_nonReg","2026-03-06","passed","2026-03-06","","authentication/session/session-timeout-reactivate.spec.ts","",""
"","23430","Un utilisateur peut échanger de l'USDC contre du BTC avec succès","sandbox_desktop_nonReg","2026-03-06","failed","2026-03-06","","trading/swap-cryptos.spec.ts","",""
"","12543","La page de choix du type de compte respecte les règles d'accessibilité (axe-core)","sandbox_desktop_nonReg","2026-03-06","passed","2026-03-06","","onboarding/accessibility.spec.ts","",""
"","17818","L'onglet Retraits affiche les retraits avec les informations attendues","sandbox_desktop_nonReg","2026-03-06","passed","2026-03-06","","history/transactions-history/transaction-history.spec.ts","",""
"","21808","Un utilisateur peut accéder aux écrans d'achat, vente, dépôt et retrait via les boutons rapides du dashboard","sandbox_desktop_nonReg","2026-03-06","passed","2026-03-06","","navigation/in-app/dashboard-quick-actions.spec.ts","",""
"","52201","Un utilisateur peut naviguer et soumettre le formulaire de connexion au clavier","sandbox_desktop_nonReg","2026-03-06","passed","2026-03-06","","authentication/sign-in/keyboard-navigation.spec.ts","",""
"","251174","Un utilisateur peut changer son mot de passe avec succès","sandbox_desktop_nonReg","2026-03-06","passed","2026-03-06","","account/change-password/nominal.spec.ts","",""
"","18627","Le formulaire de création de bouton marchand affiche les messages d'erreur appropriés en cas de données invalides","sandbox_desktop_nonReg","2026-03-06","passed","2026-03-06","","connections/merchant-buttons/create-form-validations.spec.ts","",""
"","54954","Un utilisateur peut déposer des euros sur son compte via Open Banking avec succès","sandbox_desktop_nonReg","2026-03-06","passed","2026-03-06","","transfers/deposit.spec.ts","",""
"","78394","Un utilisateur peut acheter du BTC en ordre limite avec succès","sandbox_desktop_nonReg","2026-03-06","failed","2026-03-06","","trading/expert-mode.spec.ts","",""
"","16596","Un utilisateur peut naviguer du dashboard vers l'achat de BTC via la fiche crypto","sandbox_desktop_nonReg","2026-03-06","failed","2026-03-06","","navigation/to-buy/dashboard-to-btc-buy.spec.ts","",""
"","83989","Un utilisateur peut annuler un ordre actif BTC avec succès","sandbox_desktop_nonReg","2026-03-06","failed","2026-03-06","","trading/expert-mode.spec.ts","",""
"","20662","Le formulaire de création de token API affiche les messages d'erreur appropriés en cas de données invalides","sandbox_desktop_nonReg","2026-03-06","passed","2026-03-06","","connections/api-tokens/create-form-validations.spec.ts","",""
"","17771","Un utilisateur peut accéder aux détails d'une crypto et naviguer vers achat/vente/dépôt/retrait depuis la fiche crypto","sandbox_desktop_nonReg","2026-03-06","failed","2026-03-06","","navigation/in-app/dashboard-market-list.spec.ts","",""
"","106438","La déconnexion dans un onglet invalide la session dans un autre onglet","sandbox_desktop_nonReg","2026-03-06","passed","2026-03-06","","authentication/session/multi-sessions-invalidate.spec.ts","",""
"","23190","La page d'achat/vente respecte les règles d'accessibilité (axe-core)","sandbox_desktop_nonReg","2026-03-06","passed","2026-03-06","","trading/accessibility.spec.ts","",""
"","64268","Un utilisateur est redirigé vers le dépôt EUR après connexion via /deposit/EUR","sandbox_desktop_nonReg","2026-03-06","passed","2026-03-06","","authentication/sign-in/redirections.spec.ts","",""
"","62865","Un utilisateur peut se connecter avec des identifiants valides et sans 2FA","sandbox_desktop_nonReg","2026-03-06","passed","2026-03-06","","authentication/sign-in/nominal.spec.ts","",""
