"DESCRIPTION","DURATION IN MS","NAME","PARENT SUITE","START TIME","STATUS","STOP TIME","SUB SUITE","SUITE","TEST CLASS","TEST METHOD"
"","102976","Un utilisateur peut créer un ticket de support, ajouter un commentaire, puis fermer le ticket","sandbox_desktop_nonReg","2026-03-27","passed","2026-03-27","","support/tickets/lifecycle.spec.ts","",""
"","29775","Un utilisateur peut effectuer un transfert interne entre ses comptes deposit->trading avec succès","sandbox_desktop_nonReg","2026-03-27","passed","2026-03-27","","transfers/internal/deposit-to-trading.spec.ts","",""
"","18456","Un utilisateur peut acheter de l'ETH via une nouvelle carte de paiement avec succès","sandbox_desktop_nonReg","2026-03-27","failed","2026-03-27","","trading/buy-cryptos/buy-eth-payment-card.spec.ts","",""
"","299548","Un utilisateur peut acheter du BTC au marché avec succès","sandbox_desktop_nonReg","2026-03-27","passed","2026-03-27","","trading/expert-mode/buy-btc-market.spec.ts","",""
"","21064","Un utilisateur peut naviguer du wallet vers le dépôt de BTC via la fiche crypto","sandbox_desktop_nonReg","2026-03-27","passed","2026-03-27","","navigation/to-deposit/wallet-to-btc-deposit.spec.ts","",""
"","8649","Un utilisateur peut refuser les cookies et la modale se ferme","sandbox_desktop_nonReg","2026-03-27","passed","2026-03-27","","cookies/axeptio/refuse-all.spec.ts","",""
"","13602","Un utilisateur ne peut pas se connecter avec un email non enregistré","sandbox_desktop_nonReg","2026-03-27","passed","2026-03-27","","authentication/sign-in/unregistered.spec.ts","",""
"","68804","Un utilisateur ne peut pas se connecter avec un mot de passe incorrect","sandbox_desktop_nonReg","2026-03-27","passed","2026-03-27","","authentication/sign-in/wrong-password.spec.ts","",""
"","313763","Un utilisateur peut vendre du BTC au marché avec succès","sandbox_desktop_nonReg","2026-03-27","passed","2026-03-27","","trading/expert-mode/sell-btc-market.spec.ts","",""
"","17456","Un utilisateur ne peut pas créer un token API avec un mot de passe incorrect","sandbox_desktop_nonReg","2026-03-27","passed","2026-03-27","","connections/api-tokens/create-bad-password.spec.ts","",""
"","21850","La déconnexion dans un onglet invalide la session dans un autre onglet","sandbox_desktop_nonReg","2026-03-27","passed","2026-03-27","","authentication/session/multi-sessions-invalidate.spec.ts","",""
"","19009","L'historique des exports précédents est visible avec les boutons de téléchargement","sandbox_desktop_nonReg","2026-03-27","passed","2026-03-27","","history/exports/download-nominal.spec.ts","",""
"","25347","Un utilisateur est automatiquement déconnecté après l'expiration de sa session","sandbox_desktop_nonReg","2026-03-27","passed","2026-03-27","","authentication/session/session-timeout-logout.spec.ts","",""
"","31012","Un utilisateur peut créer un bouton marchand avec succès","sandbox_desktop_nonReg","2026-03-27","failed","2026-03-27","","connections/merchant-buttons/create-nominal.spec.ts","",""
"","19044","Un utilisateur peut échanger de l'ETH contre du BTC avec succès","sandbox_desktop_nonReg","2026-03-27","failed","2026-03-27","","trading/swap-cryptos/swap-eth-to-btc.spec.ts","",""
"","18328","Un utilisateur peut naviguer du dashboard vers le dépôt de BTC via la fiche crypto","sandbox_desktop_nonReg","2026-03-27","passed","2026-03-27","","navigation/to-deposit/dashboard-to-btc-deposit.spec.ts","",""
"","26153","La page d'historique des exports affiche un état vide approprié lorsqu'il n'y a pas d'exports","sandbox_desktop_nonReg","2026-03-27","passed","2026-03-27","","history/exports/empty-state.spec.ts","",""
"","17037","Un utilisateur peut naviguer du dashboard vers la vente de BTC via la fiche crypto","sandbox_desktop_nonReg","2026-03-27","passed","2026-03-27","","navigation/to-sell/dashboard-to-btc-sell.spec.ts","",""
"","93871","Un utilisateur peut réinitialiser son mot de passe avec succès via le lien envoyé par email","sandbox_desktop_nonReg","2026-03-27","passed","2026-03-27","","authentication/reset-password/nominal.spec.ts","",""
"","16967","Le formulaire de création de token API affiche les messages d'erreur appropriés en cas de données invalides","sandbox_desktop_nonReg","2026-03-27","passed","2026-03-27","","connections/api-tokens/create-form-validations.spec.ts","",""
"","78947","Un utilisateur avec l'authentification à deux facteurs activée ne peut pas se connecter avec un code 2FA incorrect","sandbox_desktop_nonReg","2026-03-27","passed","2026-03-27","","authentication/two-factor/bad-code-login.spec.ts","",""
"","16849","Un utilisateur est redirigé vers son profil après connexion via /profile/identity","sandbox_desktop_nonReg","2026-03-27","passed","2026-03-27","","authentication/sign-in-redirections/redirections.spec.ts","",""
"","16815","Un utilisateur est redirigé vers le wallet après connexion via /wallet","sandbox_desktop_nonReg","2026-03-27","passed","2026-03-27","","authentication/sign-in-redirections/redirections.spec.ts","",""
"","31790","La page de présentation du Plan Bitcoin Famille est accessible et affiche les informations clés","sandbox_desktop_nonReg","2026-03-27","passed","2026-03-27","","investment/family-plan/presentation-user.spec.ts","",""
"","45491","Un utilisateur peut créer un token API avec succès","sandbox_desktop_nonReg","2026-03-27","failed","2026-03-27","","connections/api-tokens/create-nominal.spec.ts","",""
"","17046","Un utilisateur peut déposer des cryptomonnaies sur son compte avec succès","sandbox_desktop_nonReg","2026-03-27","passed","2026-03-27","","transfers/deposit/crypto-deposit.spec.ts","",""
"","48848","Un utilisateur peut créer, éditer, mettre en pause, reprendre et stopper un DCA","sandbox_desktop_nonReg","2026-03-27","passed","2026-03-27","","investment/dca/lifecycle.spec.ts","",""
"","16394","Un utilisateur peut naviguer du dashboard vers l'achat d'ETH via la fiche crypto","sandbox_desktop_nonReg","2026-03-27","passed","2026-03-27","","navigation/to-buy/dashboard-to-eth-buy.spec.ts","",""
"","16823","Un utilisateur est redirigé vers le dashboard après connexion via /dashboard","sandbox_desktop_nonReg","2026-03-27","passed","2026-03-27","","authentication/sign-in-redirections/redirections.spec.ts","",""
"","28173","Un utilisateur ne peut pas changer son mot de passe avec un mot de passe actuel incorrect","sandbox_desktop_nonReg","2026-03-27","passed","2026-03-27","","account/change-password/bad-current-password.spec.ts","",""
"","22626","Le formulaire de création de DCA affiche les messages d'erreur appropriés en cas de données invalides","sandbox_desktop_nonReg","2026-03-27","passed","2026-03-27","","investment/dca/create-form-validations.spec.ts","",""
"","71337","L'historique des transactions affiche un état vide approprié lorsqu'il n'y a pas de transactions","sandbox_desktop_nonReg","2026-03-27","passed","2026-03-27","","history/transactions-history/empty-state.spec.ts","",""
"","409376","Un utilisateur peut annuler un ordre actif BTC avec succès","sandbox_desktop_nonReg","2026-03-27","failed","2026-03-27","","trading/expert-mode/cancel-active-order.spec.ts","",""
"","46848","Un utilisateur est vérouillé après plusieurs tentatives de connexion infructueuses","sandbox_desktop_nonReg","2026-03-27","passed","2026-03-27","","authentication/locked-account/nominal.spec.ts","",""
"","16472","Un utilisateur peut naviguer du dashboard vers l'achat d'USDC via la fiche crypto","sandbox_desktop_nonReg","2026-03-27","passed","2026-03-27","","navigation/to-buy/dashboard-to-usdc-buy.spec.ts","",""
"","42366","Un utilisateur peut activer et désactiver l'authentification à deux facteurs avec succès","sandbox_desktop_nonReg","2026-03-27","passed","2026-03-27","","authentication/two-factor/back-and-forth.spec.ts","",""
"","15176","Un utilisateur non authentifié peut accéder aux routes publiques sans être redirigé vers la page de connexion","sandbox_desktop_nonReg","2026-03-27","passed","2026-03-27","","authentication/public-routes/unauthenticated-access.spec.ts","",""
"","16244","Un utilisateur ne peut pas initier un retrait de cryptomonnaies s'il n'a pas d'adresse de retrait enregistrée","sandbox_desktop_nonReg","2026-03-27","passed","2026-03-27","","transfers/deposit/crypto-without-address.spec.ts","",""
"","30226","Le formulaire de création de ticket de support affiche les messages d'erreur appropriés en cas de données invalides","sandbox_desktop_nonReg","2026-03-27","passed","2026-03-27","","support/tickets/create-form-validations.spec.ts","",""
"","83004","Un utilisateur peut changer son mot de passe avec succès","sandbox_desktop_nonReg","2026-03-27","passed","2026-03-27","","account/change-password/nominal.spec.ts","",""
"","18324","Le formulaire de modification de DCA affiche les messages d'erreur appropriés en cas de données invalides","sandbox_desktop_nonReg","2026-03-27","passed","2026-03-27","","investment/dca/edit-form-validations.spec.ts","",""
"","56767","Un utilisateur non authentifié est redirigé vers la page de connexion lorsqu'il tente d'accéder aux routes protégées","sandbox_desktop_nonReg","2026-03-27","passed","2026-03-27","","authentication/protected-routes/unauthenticated-access.spec.ts","",""
"","18401","Un utilisateur peut acheter de l'USDC via le compte de trading avec succès","sandbox_desktop_nonReg","2026-03-27","failed","2026-03-27","","trading/buy-cryptos/buy-usdc-trading-account.spec.ts","",""
"","13593","Le formulaire de réinitialisation du mot de passe affiche un message de succès même si l'email n'est pas enregistré (obfuscation)","sandbox_desktop_nonReg","2026-03-27","passed","2026-03-27","","authentication/reset-password/unregistered.spec.ts","",""
"","42523","Un Utilisateur B2C peut compléter le flow d'onboarding avec succès","sandbox_desktop_nonReg","2026-03-27","passed","2026-03-27","","onboarding/complete-flows/b2c.spec.ts","",""
"","18769","Un utilisateur peut échanger de l'USDC contre du BTC avec succès","sandbox_desktop_nonReg","2026-03-27","failed","2026-03-27","","trading/swap-cryptos/swap-usdc-to-btc.spec.ts","",""
"","15475","Un utilisateur peut se connecter avec des identifiants valides et sans 2FA","sandbox_desktop_nonReg","2026-03-27","passed","2026-03-27","","authentication/sign-in/nominal.spec.ts","",""
"","19344","Un utilisateur peut se déconnecter avec succès","sandbox_desktop_nonReg","2026-03-27","passed","2026-03-27","","authentication/sign-out/nominal.spec.ts","",""
"","19936","Un utilisateur peut naviguer vers les principales sections du site via le menu utilisateur","sandbox_desktop_nonReg","2026-03-27","passed","2026-03-27","","navigation/in-app/user-menu.spec.ts","",""
"","17192","Un utilisateur peut vendre du BTC avec succès","sandbox_desktop_nonReg","2026-03-27","passed","2026-03-27","","trading/sell-cryptos/sell-btc.spec.ts","",""
"","18810","Un utilisateur peut générer un lien de parrainage et le partager","sandbox_desktop_nonReg","2026-03-27","passed","2026-03-27","","referral/program/referral-link.spec.ts","",""
"","22609","Un utilisateur peut réactiver sa session après une expiration temporaire sans être redirigé vers la page de connexion","sandbox_desktop_nonReg","2026-03-27","passed","2026-03-27","","authentication/session/session-timeout-reactivate.spec.ts","",""
"","17662","La page d'inscription B2C (email) respecte les règles d'accessibilité (axe-core)","sandbox_desktop_nonReg","2026-03-27","passed","2026-03-27","","onboarding/accessibility.spec.ts","",""
"","32733","Un utilisateur non approuvé ne peut pas initier un retrait et voit un message d'erreur approprié","sandbox_desktop_nonReg","2026-03-27","passed","2026-03-27","","transfers/withdraw/not-approved.spec.ts","",""
"","18382","Un utilisateur peut s'inscrire via un lien de parrainage et le parrain le voit","sandbox_desktop_nonReg","2026-03-27","passed","2026-03-27","","referral/program/referral-sign-up.spec.ts","",""
"","19235","Le formulaire de création de bouton marchand affiche les messages d'erreur appropriés en cas de données invalides","sandbox_desktop_nonReg","2026-03-27","passed","2026-03-27","","connections/merchant-buttons/create-form-validations.spec.ts","",""
"","72692","Un utilisateur peut naviguer et soumettre le formulaire de connexion au clavier","sandbox_desktop_nonReg","2026-03-27","passed","2026-03-27","","authentication/sign-in-ally/keyboard-navigation.spec.ts","",""
"","28144","Le formulaire de changement de mot de passe affiche les messages d'erreur appropriés en cas de données invalides","sandbox_desktop_nonReg","2026-03-27","passed","2026-03-27","","account/change-password/form-validations.spec.ts","",""
"","16825","Le formulaire d'échange de cryptomonnaies affiche les messages d'erreur appropriés en cas de données invalides","sandbox_desktop_nonReg","2026-03-27","passed","2026-03-27","","trading/swap-cryptos/form-validations.spec.ts","",""
"","79825","Le dashboard respecte les règles d'accessibilité (axe-core)","sandbox_desktop_nonReg","2026-03-27","passed","2026-03-27","","accessibility.spec.ts","",""
"","17852","Un utilisateur peut acheter de l'ETH via le compte de trading avec succès","sandbox_desktop_nonReg","2026-03-27","failed","2026-03-27","","trading/buy-cryptos/buy-eth-trading-account.spec.ts","",""
"","121131","Un utilisateur peut ajouter une adresse de retrait ETH avec succès","sandbox_desktop_nonReg","2026-03-27","passed","2026-03-27","","wallet/crypto-addresses/add-eth-address.spec.ts","",""
"","16244","Un utilisateur peut naviguer du dashboard vers le dépôt de BTC via la fiche crypto","sandbox_desktop_nonReg","2026-03-27","passed","2026-03-27","","navigation/in-app/dashboard-market-list.spec.ts","",""
"","107686","Un utilisateur peut ajouter une adresse de retrait BTC avec succès","sandbox_desktop_nonReg","2026-03-27","passed","2026-03-27","","wallet/crypto-addresses/add-btc-address.spec.ts","",""
"","45197","Un utilisateur peut déposer des euros sur son compte via Open Banking avec succès","sandbox_desktop_nonReg","2026-03-27","passed","2026-03-27","","transfers/deposit/eur-open-banking.spec.ts","",""
"","18534","Un utilisateur peut échanger de l'ETH contre de l'USDC avec succès","sandbox_desktop_nonReg","2026-03-27","failed","2026-03-27","","trading/swap-cryptos/swap-eth-to-usdc.spec.ts","",""
"","17792","Un utilisateur peut vendre de l'ETH avec succès","sandbox_desktop_nonReg","2026-03-27","failed","2026-03-27","","trading/sell-cryptos/sell-eth.spec.ts","",""
"","25779","Un utilisateur peut naviguer du wallet vers le retrait de BTC via la fiche crypto","sandbox_desktop_nonReg","2026-03-27","passed","2026-03-27","","navigation/to-withdraw/wallet-to-btc-withdrawal.spec.ts","",""
"","15694","La page de connexion avec des erreurs de formulaire respecte les règles d'accessibilité","sandbox_desktop_nonReg","2026-03-27","passed","2026-03-27","","authentication/sign-in-ally/axe-scan-errors.spec.ts","",""
"","33935","Le formulaire de retrait affiche les messages d'erreur appropriés en cas de données invalides","sandbox_desktop_nonReg","2026-03-27","passed","2026-03-27","","transfers/withdraw/form-validations.spec.ts","",""
"","46801","Un utilisateur peut retirer des BTC de son compte avec succès","sandbox_desktop_nonReg","2026-03-27","passed","2026-03-27","","transfers/withdraw/btc-withdraw.spec.ts","",""
"","18229","L'onglet Retraits affiche les retraits avec les informations attendues","sandbox_desktop_nonReg","2026-03-27","passed","2026-03-27","","history/transactions-history/withdrawals-tab.spec.ts","",""
"","11619","La page de choix du type de compte respecte les règles d'accessibilité (axe-core)","sandbox_desktop_nonReg","2026-03-27","passed","2026-03-27","","onboarding/accessibility.spec.ts","",""
"","15688","Un utilisateur peut naviguer vers l'achat de cryptomonnaies via le bouton d'achat rapide du dashboard","sandbox_desktop_nonReg","2026-03-27","passed","2026-03-27","","navigation/in-app/dashboard-quick-actions.spec.ts","",""
"","17266","La page d'inscription B2B (entreprise) respecte les règles d'accessibilité (axe-core)","sandbox_desktop_nonReg","2026-03-27","passed","2026-03-27","","onboarding/accessibility.spec.ts","",""
"","30400","Un utilisateur peut supprimer un bouton marchand avec succès","sandbox_desktop_nonReg","2026-03-27","failed","2026-03-27","","connections/merchant-buttons/delete.spec.ts","",""
"","15765","La page de connexion respecte les règles d'accessibilité (axe-core)","sandbox_desktop_nonReg","2026-03-27","passed","2026-03-27","","authentication/sign-in-ally/axe-scan.spec.ts","",""
"","16202","Un utilisateur peut naviguer du dashboard vers la vente d'ETH via la fiche crypto","sandbox_desktop_nonReg","2026-03-27","passed","2026-03-27","","navigation/to-sell/dashboard-to-eth-sell.spec.ts","",""
"","15906","Un utilisateur peut naviguer du dashboard vers la vente d'USDC via la fiche crypto","sandbox_desktop_nonReg","2026-03-27","passed","2026-03-27","","navigation/to-sell/dashboard-to-usdc-sell.spec.ts","",""
"","66210","Un utilisateur non approuvé ne peut pas créer de plan famille et voit un message d'erreur approprié","sandbox_desktop_nonReg","2026-03-27","passed","2026-03-27","","investment/family-plan/not-approved.spec.ts","",""
"","22794","Un utilisateur voit un message d'erreur lorsque le paiement par carte échoue","sandbox_desktop_nonReg","2026-03-27","passed","2026-03-27","","trading/buy-cryptos/payment-failure.spec.ts","",""
"","28337","Le formulaire de réinitialisation du mot de passe affiche les messages d'erreur appropriés en cas de données invalides","sandbox_desktop_nonReg","2026-03-27","passed","2026-03-27","","authentication/reset-password/form-validations.spec.ts","",""
"","16756","Un utilisateur peut naviguer du dashboard vers l'achat de BTC via la fiche crypto","sandbox_desktop_nonReg","2026-03-27","passed","2026-03-27","","navigation/to-buy/dashboard-to-btc-buy.spec.ts","",""
"","17291","La page d'achat/vente respecte les règles d'accessibilité (axe-core)","sandbox_desktop_nonReg","2026-03-27","passed","2026-03-27","","accessibility.spec.ts","",""
"","99538","Le mode expert respecte les règles d'accessibilité (axe-core)","sandbox_desktop_nonReg","2026-03-27","passed","2026-03-27","","accessibility.spec.ts","",""
"","18247","Un utilisateur non approuvé est redirigé vers la page d'onboarding incomplète après connexion","sandbox_desktop_nonReg","2026-03-27","passed","2026-03-27","","authentication/sign-in/resume-onboarding.spec.ts","",""
"","30783","Un utilisateur peut prévisualiser un bouton marchand une fois créé","sandbox_desktop_nonReg","2026-03-27","failed","2026-03-27","","connections/merchant-buttons/preview.spec.ts","",""
"","360","Un utilisateur peut naviguer vers les principales sections du site via le menu responsive","sandbox_desktop_nonReg","2026-03-27","skipped","2026-03-27","","navigation/in-app/responsive-menu.spec.ts","",""
"","330402","Un utilisateur peut acheter du BTC en ordre limite avec succès","sandbox_desktop_nonReg","2026-03-27","passed","2026-03-27","","trading/expert-mode/buy-btc-limit.spec.ts","",""
"","16903","Un utilisateur peut acheter du BTC via le compte de trading avec succès","sandbox_desktop_nonReg","2026-03-27","passed","2026-03-27","","trading/buy-cryptos/buy-btc-trading-account.spec.ts","",""
"","19154","Un utilisateur peut supprimer un token API avec succès","sandbox_desktop_nonReg","2026-03-27","passed","2026-03-27","","connections/api-tokens/delete-nominal.spec.ts","",""
"","28445","Un utilisateur ne peut pas désactiver l'authentification à deux facteurs avec un code incorrect","sandbox_desktop_nonReg","2026-03-27","passed","2026-03-27","","authentication/two-factor/bad-code-deactivate.spec.ts","",""
"","17901","Un utilisateur peut échanger du BTC contre de l'ETH avec succès","sandbox_desktop_nonReg","2026-03-27","failed","2026-03-27","","trading/swap-cryptos/swap-btc-to-eth.spec.ts","",""
"","16426","Un utilisateur peut naviguer entre les onglets achat, vente et échange","sandbox_desktop_nonReg","2026-03-27","passed","2026-03-27","","trading/swap-overlay/tabs-navigation.spec.ts","",""
"","17058","Un utilisateur est redirigé vers le dépôt EUR après connexion via /deposit/EUR","sandbox_desktop_nonReg","2026-03-27","passed","2026-03-27","","authentication/sign-in-redirections/redirections.spec.ts","",""
"","35620","Un utilisateur peut envoyer des euros à un destinataire via son adresse email avec succès","sandbox_desktop_nonReg","2026-03-27","failed","2026-03-27","","transfers/send-by-email/eur.spec.ts","",""
"","23692","La modale de trading se ferme correctement lorsque l'utilisateur annule","sandbox_desktop_nonReg","2026-03-27","passed","2026-03-27","","trading/buy-cryptos/cancel-payment.spec.ts","",""
"","16105","Le formulaire de vente de cryptomonnaies affiche les messages d'erreur appropriés en cas de données invalides","sandbox_desktop_nonReg","2026-03-27","passed","2026-03-27","","trading/sell-cryptos/form-validations.spec.ts","",""
"","17547","Un utilisateur peut vendre de l'USDC avec succès","sandbox_desktop_nonReg","2026-03-27","failed","2026-03-27","","trading/sell-cryptos/sell-usdc.spec.ts","",""
"","35322","Un utilisateur peut envoyer des cryptomonnaies à un destinataire via son adresse email avec succès","sandbox_desktop_nonReg","2026-03-27","failed","2026-03-27","","transfers/send-by-email/crypto.spec.ts","",""
"","3491","Un utilisateur peut accepter tous les cookies et la modale se ferme","sandbox_desktop_nonReg","2026-03-27","passed","2026-03-27","","cookies/axeptio/accept-all.spec.ts","",""
"","10534","Le formulaire de connexion affiche les messages d'erreur appropriés en cas de données invalides","sandbox_desktop_nonReg","2026-03-27","passed","2026-03-27","","authentication/sign-in/form-validations.spec.ts","",""
"","18541","Un utilisateur peut échanger du BTC contre de l'USDC avec succès","sandbox_desktop_nonReg","2026-03-27","failed","2026-03-27","","trading/swap-cryptos/swap-btc-to-usdc.spec.ts","",""
"","353465","Un utilisateur peut vendre du BTC en ordre limite avec succès","sandbox_desktop_nonReg","2026-03-27","passed","2026-03-27","","trading/expert-mode/sell-btc-limit.spec.ts","",""
"","155414","Un Utilisateur B2B peut compléter le flow d'onboarding avec succès","sandbox_desktop_nonReg","2026-03-27","failed","2026-03-27","","onboarding/complete-flows/b2b.spec.ts","",""
"","37891","La page de présentation du Plan Bitcoin Famille est accessible et affiche les informations clés à un utilisateur non connecté","sandbox_desktop_nonReg","2026-03-27","passed","2026-03-27","","investment/family-plan/presentation-guest.spec.ts","",""
"","80130","Le portefeuille respecte les règles d'accessibilité (axe-core)","sandbox_desktop_nonReg","2026-03-27","passed","2026-03-27","","accessibility.spec.ts","",""
"","31560","Un utilisateur peut effectuer un transfert interne entre ses comptes trading->deposit avec succès","sandbox_desktop_nonReg","2026-03-27","passed","2026-03-27","","transfers/internal/trading-to-deposit.spec.ts","",""
"","54620","Un utilisateur peut générer un nouvel export de transactions","sandbox_desktop_nonReg","2026-03-27","passed","2026-03-27","","history/exports/create-nominal.spec.ts","",""
"","102862","Un utilisateur peut ajouter un compte bancaire avec succès","sandbox_desktop_nonReg","2026-03-27","failed","2026-03-27","","wallet/bank-accounts/add-bank-account.spec.ts","",""
"","37080","Un utilisateur peut retirer des euros de son compte avec succès","sandbox_desktop_nonReg","2026-03-27","failed","2026-03-27","","transfers/withdraw/eur-withdraw.spec.ts","",""
"","1939","Le lien 'Gérer vos cookies' du footer ouvre la modale Axeptio","sandbox_desktop_nonReg","2026-03-27","passed","2026-03-27","","cookies/axeptio/open-from-footer.spec.ts","",""
"","18151","Un utilisateur peut échanger de l'USDC contre de l'ETH avec succès","sandbox_desktop_nonReg","2026-03-27","failed","2026-03-27","","trading/swap-cryptos/swap-usdc-to-eth.spec.ts","",""
"","32069","Un utilisateur peut acheter du BTC via une nouvelle carte de paiement avec succès","sandbox_desktop_nonReg","2026-03-27","passed","2026-03-27","","trading/buy-cryptos/buy-btc-payment-card.spec.ts","",""
"","18288","L'onglet Ordres affiche les ordres avec les informations attendues","sandbox_desktop_nonReg","2026-03-27","passed","2026-03-27","","history/transactions-history/orders-tab.spec.ts","",""
"","17131","Un utilisateur sans paramètre redirect est redirigé vers le dashboard par défaut après connexion","sandbox_desktop_nonReg","2026-03-27","passed","2026-03-27","","authentication/sign-in-redirections/redirections.spec.ts","",""
"","20354","Le formulaire d'achat de cryptomonnaies affiche les messages d'erreur appropriés en cas de données invalides","sandbox_desktop_nonReg","2026-03-27","passed","2026-03-27","","trading/buy-cryptos/form-validations.spec.ts","",""
"","18681","Un utilisateur peut créer un portefeuille non hébergé avec succès","sandbox_desktop_nonReg","2026-03-27","failed","2026-03-27","","wallet/unhosted-wallets/add-unhosted-wallet.spec.ts","",""
"","89608","Un utilisateur peut naviguer vers les principales sections du site via la barre de navigation","sandbox_desktop_nonReg","2026-03-27","failed","2026-03-27","","navigation/in-app/web-navbar.spec.ts","",""
"","78830","Un utilisateur ne peut pas activer l'authentification à deux facteurs avec un code incorrect","sandbox_desktop_nonReg","2026-03-27","passed","2026-03-27","","authentication/two-factor/bad-code-activation.spec.ts","",""
