"DESCRIPTION","DURATION IN MS","NAME","PARENT SUITE","START TIME","STATUS","STOP TIME","SUB SUITE","SUITE","TEST CLASS","TEST METHOD"
"","78564","Un utilisateur peut retirer des euros de son compte avec succès","local_responsive_nonReg","2026-03-06","failed","2026-03-06","","transfers/withdraw.spec.ts","",""
"","46660","La page d'achat/vente respecte les règles d'accessibilité (axe-core)","local_responsive_nonReg","2026-03-06","passed","2026-03-06","","trading/accessibility.spec.ts","",""
"","43356","Un utilisateur peut ajouter un portefeuille non hébergé avec succès","local_responsive_nonReg","2026-03-06","failed","2026-03-06","","wallet/unhosted-wallets.spec.ts","",""
"","27643","Un utilisateur non approuvé est redirigé vers la page d'onboarding incomplète après connexion","local_responsive_nonReg","2026-03-06","passed","2026-03-06","","authentication/sign-in/resume-onboarding.spec.ts","",""
"","52743","Le formulaire d'achat de cryptomonnaies affiche les messages d'erreur appropriés en cas de données invalides","local_responsive_nonReg","2026-03-06","failed","2026-03-06","","trading/buy-cryptos.spec.ts","",""
"","59159","Un Utilisateur B2B peut compléter le flow d'onboarding avec succès","local_responsive_nonReg","2026-03-06","failed","2026-03-06","","onboarding/complete-flows.spec.ts","",""
"","50758","Un utilisateur ne peut pas initier un retrait de cryptomonnaies s'il n'a pas d'adresse de retrait enregistrée","local_responsive_nonReg","2026-03-06","failed","2026-03-06","","transfers/deposit.spec.ts","",""
"","50819","La modale de trading se ferme correctement lorsque l'utilisateur annule","local_responsive_nonReg","2026-03-06","failed","2026-03-06","","trading/buy-cryptos.spec.ts","",""
"","85558","Un utilisateur peut naviguer du dashboard vers la vente d'ETH via la fiche crypto","local_responsive_nonReg","2026-03-06","passed","2026-03-06","","navigation/to-sell/dashboard-to-eth-sell.spec.ts","",""
"","41521","Un utilisateur peut se déconnecter avec succès","local_responsive_nonReg","2026-03-06","failed","2026-03-06","","authentication/sign-out/nominal.spec.ts","",""
"","47805","La page d'inscription B2B (entreprise) respecte les règles d'accessibilité (axe-core)","local_responsive_nonReg","2026-03-06","passed","2026-03-06","","onboarding/accessibility.spec.ts","",""
"","94184","Un utilisateur peut retirer des cryptomonnaies de son compte avec succès","local_responsive_nonReg","2026-03-06","failed","2026-03-06","","transfers/withdraw.spec.ts","",""
"","44189","La page d'inscription B2C (email) respecte les règles d'accessibilité (axe-core)","local_responsive_nonReg","2026-03-06","passed","2026-03-06","","onboarding/accessibility.spec.ts","",""
"","50402","Un utilisateur peut acheter du BTC via le compte de trading avec succès","local_responsive_nonReg","2026-03-06","failed","2026-03-06","","trading/buy-cryptos.spec.ts","",""
"","80462","Un utilisateur peut échanger de l'ETH contre du BTC avec succès","local_responsive_nonReg","2026-03-06","passed","2026-03-06","","trading/swap-cryptos.spec.ts","",""
"","75407","Un utilisateur ne peut pas se connecter avec un mot de passe incorrect","local_responsive_nonReg","2026-03-06","passed","2026-03-06","","authentication/sign-in/wrong-password.spec.ts","",""
"","17929","Le formulaire de connexion affiche les messages d'erreur appropriés en cas de données invalides","local_responsive_nonReg","2026-03-06","passed","2026-03-06","","authentication/sign-in/form-validations.spec.ts","",""
"","94160","Un utilisateur peut échanger de l'USDC contre du BTC avec succès","local_responsive_nonReg","2026-03-06","passed","2026-03-06","","trading/swap-cryptos.spec.ts","",""
"","20493","Le formulaire de réinitialisation du mot de passe affiche un message de succès même si l'email n'est pas enregistré (obfuscation)","local_responsive_nonReg","2026-03-06","passed","2026-03-06","","authentication/reset-password/unregistered.spec.ts","",""
"","80073","Le mode expert respecte les règles d'accessibilité (axe-core)","local_responsive_nonReg","2026-03-06","passed","2026-03-06","","trading/accessibility.spec.ts","",""
"","97962","Un utilisateur peut effectuer un transfert interne entre ses comptes trading->deposit avec succès","local_responsive_nonReg","2026-03-06","failed","2026-03-06","","transfers/internal-transfer.spec.ts","",""
"","111402","Un utilisateur peut vendre de l'USDC avec succès","local_responsive_nonReg","2026-03-06","passed","2026-03-06","","trading/sell-cryptos.spec.ts","",""
"","112459","Un utilisateur peut acheter du BTC en ordre limite avec succès","local_responsive_nonReg","2026-03-06","failed","2026-03-06","","trading/expert-mode.spec.ts","",""
"","57406","Un utilisateur peut naviguer du dashboard vers l'achat de BTC via la fiche crypto","local_responsive_nonReg","2026-03-06","failed","2026-03-06","","navigation/to-buy/dashboard-to-btc-buy.spec.ts","",""
"","88206","Le formulaire de réinitialisation du mot de passe affiche les messages d'erreur appropriés en cas de données invalides","local_responsive_nonReg","2026-03-06","failed","2026-03-06","","authentication/reset-password/form-validations.spec.ts","",""
"","63278","Un utilisateur peut annuler un ordre actif BTC avec succès","local_responsive_nonReg","2026-03-06","failed","2026-03-06","","trading/expert-mode.spec.ts","",""
"","63882","Un utilisateur peut ajouter une adresse de retrait BTC avec succès","local_responsive_nonReg","2026-03-06","failed","2026-03-06","","wallet/crypto-address.spec.ts","",""
"","44710","Un utilisateur est redirigé vers le dépôt EUR après connexion via /deposit/EUR","local_responsive_nonReg","2026-03-06","passed","2026-03-06","","authentication/sign-in/redirections.spec.ts","",""
"","81223","Un utilisateur peut échanger du BTC contre de l'USDC avec succès","local_responsive_nonReg","2026-03-06","passed","2026-03-06","","trading/swap-cryptos.spec.ts","",""
"","16694","Un utilisateur peut naviguer et soumettre le formulaire de connexion au clavier","local_responsive_nonReg","2026-03-06","passed","2026-03-06","","authentication/sign-in/keyboard-navigation.spec.ts","",""
"","64774","Un Utilisateur B2C peut compléter le flow d'onboarding avec succès","local_responsive_nonReg","2026-03-06","failed","2026-03-06","","onboarding/complete-flows.spec.ts","",""
"","67274","Un utilisateur peut créer un ticket de support, ajouter un commentaire, puis fermer le ticket","local_responsive_nonReg","2026-03-06","failed","2026-03-06","","support/support-tickets.spec.ts","",""
"","41668","Un utilisateur peut réinitialiser son mot de passe avec succès via le lien envoyé par email","local_responsive_nonReg","2026-03-06","failed","2026-03-06","","authentication/reset-password/nominal.spec.ts","",""
"","81260","Un utilisateur peut naviguer du dashboard vers la vente d'USDC via la fiche crypto","local_responsive_nonReg","2026-03-06","passed","2026-03-06","","navigation/to-sell/dashboard-to-usdc-sell.spec.ts","",""
"","48268","Le composant de swap (achat/vente/conversion) affiche les valeurs de prévisualisation correctes avant la confirmation","local_responsive_nonReg","2026-03-06","failed","2026-03-06","","trading/swap-overlay.spec.ts","",""
"","49582","Un utilisateur voit un message d'erreur lorsque le paiement par carte échoue","local_responsive_nonReg","2026-03-06","failed","2026-03-06","","trading/buy-cryptos.spec.ts","",""
"","115111","Un utilisateur peut acheter de l'ETH via le compte de trading avec succès","local_responsive_nonReg","2026-03-06","passed","2026-03-06","","trading/buy-cryptos.spec.ts","",""
"","70428","Un utilisateur est vérouillé après plusieurs tentatives de connexion infructueuses","local_responsive_nonReg","2026-03-06","passed","2026-03-06","","authentication/locked-account/nominal.spec.ts","",""
"","46241","Un utilisateur est redirigé vers le dashboard après connexion via /dashboard","local_responsive_nonReg","2026-03-06","passed","2026-03-06","","authentication/sign-in/redirections.spec.ts","",""
"","53725","Un utilisateur peut déposer des euros sur son compte via Open Banking avec succès","local_responsive_nonReg","2026-03-06","failed","2026-03-06","","transfers/deposit.spec.ts","",""
"","44552","Un utilisateur est redirigé vers le wallet après connexion via /wallet","local_responsive_nonReg","2026-03-06","passed","2026-03-06","","authentication/sign-in/redirections.spec.ts","",""
"","45050","Un utilisateur sans paramètre redirect est redirigé vers le dashboard par défaut après connexion","local_responsive_nonReg","2026-03-06","passed","2026-03-06","","authentication/sign-in/redirections.spec.ts","",""
"","62387","Un utilisateur peut naviguer du dashboard vers l'achat d'ETH via la fiche crypto","local_responsive_nonReg","2026-03-06","failed","2026-03-06","","navigation/to-buy/dashboard-to-eth-buy.spec.ts","",""
"","18746","Un utilisateur ne peut pas se connecter avec un email non enregistré","local_responsive_nonReg","2026-03-06","passed","2026-03-06","","authentication/sign-in/unregistered.spec.ts","",""
"","97072","Un utilisateur peut naviguer du dashboard vers l'achat d'USDC via la fiche crypto","local_responsive_nonReg","2026-03-06","passed","2026-03-06","","navigation/to-buy/dashboard-to-usdc-buy.spec.ts","",""
"","42601","La page de choix du type de compte respecte les règles d'accessibilité (axe-core)","local_responsive_nonReg","2026-03-06","passed","2026-03-06","","onboarding/accessibility.spec.ts","",""
"","24700","Un utilisateur peut se connecter avec des identifiants valides et sans 2FA","local_responsive_nonReg","2026-03-06","passed","2026-03-06","","authentication/sign-in/nominal.spec.ts","",""
"","54198","Un utilisateur peut vendre du BTC au marché avec succès","local_responsive_nonReg","2026-03-06","failed","2026-03-06","","trading/expert-mode.spec.ts","",""
"","20425","La page de connexion avec des erreurs de formulaire respecte les règles d'accessibilité","local_responsive_nonReg","2026-03-06","passed","2026-03-06","","authentication/sign-in/axe-scan-errors.spec.ts","",""
"","121069","Un utilisateur peut vendre du BTC en ordre limite avec succès","local_responsive_nonReg","2026-03-06","failed","2026-03-06","","trading/expert-mode.spec.ts","",""
"","104548","Un utilisateur peut acheter de l'ETH via une nouvelle carte de paiement avec succès","local_responsive_nonReg","2026-03-06","failed","2026-03-06","","trading/buy-cryptos.spec.ts","",""
"","89411","Un utilisateur peut ajouter un compte bancaire avec succès","local_responsive_nonReg","2026-03-06","failed","2026-03-06","","wallet/bank-account.spec.ts","",""
"","4027","Un utilisateur peut naviguer vers les principales sections du site via la barre de navigation","local_responsive_nonReg","2026-03-06","skipped","2026-03-06","","navigation/in-app/web-navbar.spec.ts","",""
"","52178","Un utilisateur ne peut pas activer l'authentification à deux facteurs avec un code incorrect","local_responsive_nonReg","2026-03-06","passed","2026-03-06","","authentication/two-factor/bad-code-activation.spec.ts","",""
"","140537","Un utilisateur non approuvé ne peut pas initier un retrait et voit un message d'erreur approprié","local_responsive_nonReg","2026-03-06","failed","2026-03-06","","transfers/withdraw.notApproved.spec.ts","",""
"","95029","Un utilisateur peut acheter de l'USDC via le compte de trading avec succès","local_responsive_nonReg","2026-03-06","passed","2026-03-06","","trading/buy-cryptos.spec.ts","",""
"","106598","Le formulaire de retrait affiche les messages d'erreur appropriés en cas de données invalides","local_responsive_nonReg","2026-03-06","passed","2026-03-06","","transfers/withdraw.spec.ts","",""
"","52886","Un utilisateur peut vendre de l'ETH avec succès","local_responsive_nonReg","2026-03-06","failed","2026-03-06","","trading/sell-cryptos.spec.ts","",""
"","54237","Un utilisateur peut échanger de l'USDC contre de l'ETH avec succès","local_responsive_nonReg","2026-03-06","failed","2026-03-06","","trading/swap-cryptos.spec.ts","",""
"","54396","Un utilisateur peut effectuer un transfert interne entre ses comptes deposit->trading avec succès","local_responsive_nonReg","2026-03-06","failed","2026-03-06","","transfers/internal-transfer.spec.ts","",""
"","84772","Un utilisateur peut naviguer entre les onglets achat, vente et échange","local_responsive_nonReg","2026-03-06","passed","2026-03-06","","trading/swap-overlay.spec.ts","",""
"","49043","La déconnexion dans un onglet invalide la session dans un autre onglet","local_responsive_nonReg","2026-03-06","failed","2026-03-06","","authentication/session/multi-sessions-invalidate.spec.ts","",""
"","133458","Un utilisateur peut activer et désactiver l'authentification à deux facteurs avec succès","local_responsive_nonReg","2026-03-06","passed","2026-03-06","","authentication/two-factor/back-and-forth.spec.ts","",""
"","51320","Un utilisateur ne peut pas changer son mot de passe avec un mot de passe actuel incorrect","local_responsive_nonReg","2026-03-06","passed","2026-03-06","","account/change-password/bad-current-password.spec.ts","",""
"","121916","Un utilisateur peut échanger du BTC contre de l'ETH avec succès","local_responsive_nonReg","2026-03-06","passed","2026-03-06","","trading/swap-cryptos.spec.ts","",""
"","44392","Un utilisateur est redirigé vers son profil après connexion via /profile/identity","local_responsive_nonReg","2026-03-06","passed","2026-03-06","","authentication/sign-in/redirections.spec.ts","",""
"","61438","Un utilisateur peut naviguer du dashboard vers la vente de BTC via la fiche crypto","local_responsive_nonReg","2026-03-06","failed","2026-03-06","","navigation/to-sell/dashboard-to-btc-sell.spec.ts","",""
"","81415","Un utilisateur peut envoyer des cryptomonnaies à un destinataire via son adresse email avec succès","local_responsive_nonReg","2026-03-06","failed","2026-03-06","","transfers/send-by-email.spec.ts","",""
"","30300","Un utilisateur non authentifié peut accéder aux routes publiques sans être redirigé vers la page de connexion","local_responsive_nonReg","2026-03-06","passed","2026-03-06","","authentication/public-routes/unauthenticated-access.spec.ts","",""
"","46255","Un utilisateur peut acheter du BTC au marché avec succès","local_responsive_nonReg","2026-03-06","failed","2026-03-06","","trading/expert-mode.spec.ts","",""
"","141117","Un utilisateur peut acheter du BTC via une nouvelle carte de paiement avec succès","local_responsive_nonReg","2026-03-06","passed","2026-03-06","","trading/buy-cryptos.spec.ts","",""
"","41723","Un utilisateur est automatiquement déconnecté après l'expiration de sa session","local_responsive_nonReg","2026-03-06","failed","2026-03-06","","authentication/session/session-timeout-logout.spec.ts","",""
"","163941","Un utilisateur non authentifié est redirigé vers la page de connexion lorsqu'il tente d'accéder aux routes protégées","local_responsive_nonReg","2026-03-06","passed","2026-03-06","","authentication/protected-routes/unauthenticated-access.spec.ts","",""
"","82411","Le dashboard respecte les règles d'accessibilité (axe-core)","local_responsive_nonReg","2026-03-06","passed","2026-03-06","","trading/accessibility.spec.ts","",""
"","180916","Le formulaire de changement de mot de passe affiche les messages d'erreur appropriés en cas de données invalides","local_responsive_nonReg","2026-03-06","passed","2026-03-06","","account/change-password/form-validations.spec.ts","",""
"","19475","La page de connexion respecte les règles d'accessibilité (axe-core)","local_responsive_nonReg","2026-03-06","passed","2026-03-06","","authentication/sign-in/axe-scan.spec.ts","",""
"","94534","Le portefeuille respecte les règles d'accessibilité (axe-core)","local_responsive_nonReg","2026-03-06","passed","2026-03-06","","trading/accessibility.spec.ts","",""
"","84719","Un utilisateur peut envoyer des euros à un destinataire via son adresse email avec succès","local_responsive_nonReg","2026-03-06","failed","2026-03-06","","transfers/send-by-email.spec.ts","",""
"","242475","Un utilisateur peut changer son mot de passe avec succès","local_responsive_nonReg","2026-03-06","passed","2026-03-06","","account/change-password/nominal.spec.ts","",""
"","53402","Un utilisateur peut réactiver sa session après une expiration temporaire sans être redirigé vers la page de connexion","local_responsive_nonReg","2026-03-06","failed","2026-03-06","","authentication/session/session-timeout-reactivate.spec.ts","",""
"","52965","Un utilisateur peut vendre du BTC avec succès","local_responsive_nonReg","2026-03-06","failed","2026-03-06","","trading/sell-cryptos.spec.ts","",""
"","76778","Un utilisateur peut échanger de l'ETH contre de l'USDC avec succès","local_responsive_nonReg","2026-03-06","passed","2026-03-06","","trading/swap-cryptos.spec.ts","",""
"","51545","Un utilisateur peut déposer des cryptomonnaies sur son compte avec succès","local_responsive_nonReg","2026-03-06","failed","2026-03-06","","transfers/deposit.spec.ts","",""
